Cohere,—,101-250,"Cohere is a platform that gives developers and businesses access to NLP, powered by the latest generation of large language models. Cohere is used for building machines that understand the world and make them safely accessible to all. Cohere provides access to affordable, easy-to-deploy large language models. Its platform gives computers the ability to read and write - whether to better understand what customers are saying, or to write compelling copy that speaks to a target audience, Cohere can help.","Toronto, Ontario, Canada",2019,"Artificial Intelligence, Natural Language Processing,",Cohere offers an API to add language processing to any system.,"Mar 7, 2023",Venture - Series Unknown,—,"Tiger Global Management, Salesforce Ventures,,,",—,—,Great Lakes
HealthPlix,—,251-500,"HealthPlix pioneered the digitization of healthcare through its future-ready AI-powered EMR platform for doctors in India. The start-up currently empowers 10K+ doctors to drive better health outcomes for their patients by providing clinical decision support at the point of care. More than 22 million patients have been treated using the HealthPlix EMR platform by doctors across 16 specialties. HealthPlix's doctor base and network span across 370+ cities in India, making it the trusted EMR platform for doctors in the country.","Bangalore, Karnataka, India",2014,"Artificial Intelligence, Health Care,,",HealthPlix is a digital health platform that uses AI technologies to support clinical decisions.,"Mar 15, 2023",Series C,"$20,000,000","BlackSoil, Lightspeed Venture Partners,,,",$1M to $10M,—,Asia-Pacific (APAC)
Rapid7,—,1001-5000,"Rapid7 provides security data and analytics solutions enabling organizations to implement an active approach to cybersecurity. The company's IT security solutions deliver visibility and insight that help to make informed decisions, create credible action plans, and monitor progress. Their services include detection and response, vulnerability management, application security, security advisory services, product consulting, penetration services, IoT security testing, and more.","Boston, Massachusetts, United States",2000,"Analytics, Cyber Security, Enterprise Software,,",Rapid7 unites cloud risk management and threat detection to deliver results that secure businesses.,"Dec 17, 2014",Series D,"$30,000,000","Bain Capital Ventures, TCV",$500M to $1B,Black / African American Led,"Greater Boston Area, East Coast,"
SpaceX,—,5001-10000,"Space Exploration Technologies is a space-transportation startup company founded by Elon Musk. SpaceX designs, manufactures, and launches advanced rockets and spacecraft. SpaceX develops crew and cargo capsules, engines, cryogenic tank structures, avionics, equipment, guidance, and control software. The company is developing the partially reusable launch vehicles Falcon 1 and Falcon 9. Founded in 2002, Space Exploration Technologies is headquartered in Hawthorne, California.","Hawthorne, California, United States","May 6, 2002","Advanced Materials, Aerospace,,,",SpaceX is an aviation and aerospace company that focuses on reducing costs associated with space travel.,"Mar 23, 2023",Grant,—,"Google, NASA, Sequoia Capital,,",$1B to $10B,—,"Greater Los Angeles Area, West Coast,"
Rain,—,251-500,"Rain is a fast-growing early wage access and financial wellness benefit vendor globally. With operations in the U.S., Brazil, and India, Rain provides a voluntary employee benefit that is free for employers to implement. Rain integrates with payroll and timekeeping vendors to create a seamless process with almost zero work for the employer. Through Rain, not only can employees access their pay any day of the week (instead of waiting the traditional two weeks for payday), but they can also take advantage of a free pay card, the ability to instantly access tips after a shift, and other financial wellness tools such as a credit score builder and financial literacy materials. Rain also can offer deep discounts on dozens of other voluntary benefits such as prescriptions and dental care. Employers win by having one of the leading employee benefits that workers are asking for and by seeing reductions in turnover and increases in job applications.","Santa Monica, California, United States",Jul 2019,"Employee Benefits, Financial Services,,",Rain offers early wage access and financial wellness benefit for mid-market to enterprise employers.,"Mar 21, 2023",Series A,"$66,000,000","Tribe Capital, Vijay Shankar, QED Investors,,",—,Women Founded,"Greater Los Angeles Area, West Coast,"
Amogy,—,101-250,"Amogy is a sustainable energy start-up that is working on a novel carbon-free energy system using ammonia as a renewable fuel. The innovative solution enables the decarbonization of ground, sea, and air transportation, accelerating the journey towards net zero economies.","Brooklyn, New York, United States","Nov 18, 2020","Clean Energy, CleanTech, Energy,,",Amogy offers an innovative clean energy system using ammonia as a renewable fuel.,"Mar 22, 2023",Series B,"$139,200,000","Yanmar Ventures, Amazon, DCVC,,",—,—,"Greater New York Area, East Coast,"
