Qualtrics,—,1001-5000,"Qualtrics is a single system of record for all experience data, also called X-data, allowing organizations to manage the four core experiences of business—customer, product, employee, and brand experiences—on one platform. Over 8,500 enterprises worldwide, including more than 75 percent of the Fortune 100 and 99 of the top 100 U.S. business schools, rely on Qualtrics.","Provo, Utah, United States",2002,"Consumer, Data Integration, Market Research,","Qualtrics is a single system of record for all experience data, managing customer, product, employee, and brand experiences on one platform.","Apr 12, 2017",Series C,"$180,000,000","Sequoia Capital, Accel, Insight Partners",$500M to $1B,—,Western US
Sanofi,—,10001+,"Sanofi offers research, development, manufacturing, and marketing of innovative therapeutic solutions. It covers areas such as diabetes solutions, human vaccines, innovative drugs, consumer healthcare, emerging markets, animal health, and the new G enzyme.","Bridgewater, New Jersey, United States",2004,"Health Care, Life Science, Pharmaceutical,",Sanofi is a healthcare company that provides treatments and the protection of life-saving vaccines.,"Mar 15, 2022",Post-IPO Equity,"€300,000,000","Evotec, Blackstone Life Sciences",$10B+,—,"East Coast, Northeastern US"
Coinbase,—,1001-5000,"Coinbase is an online platform that allows merchants, consumers, and traders to transact with digital currency. It allows its users to create their own bitcoin wallets and start buying or selling bitcoins by connecting with their bank accounts. Also, it provides a series of merchant payment processing systems and tools that support many highly-trafficked websites on the internet. Coinbase was launched in 2012 with a mission to create an open financial system for the world. It is operated from San Francisco, California.","San Francisco, California, United States",2012,"Bitcoin, Blockchain, Cryptocurrency,,","Coinbase is an online platform that allows merchants, consumers, and traders to transact with digital currency.","Nov 9, 2022",Post-IPO Equity,"$21,400,000","Andreessen Horowitz, Y Combinator,,,",$1B to $10B,—,"San Francisco Bay Area, West Coast,"
Brex,—,1001-5000,"Brex is a spend platform that includes corporate cards, cost management, reimbursements, and bill pay all in one place. Brex makes it easy for finance teams and founders to manage every aspect of global spend at scale by empowering their employees anywhere to make better financial decisions. Brex proudly serves tens of thousands of businesses, from enterprises to startups.","San Francisco, California, United States",Mar 2017,"Banking, Credit Cards, Financial Services,","Brex is a spend platform that includes corporate cards, cost management, reimbursements, and bill pay.","May 18, 2022",Series D,—,"Credit Suisse, Y Combinator, Tiger Global Management,,",$100M to $500M,"Hispanic / Latine Founded, Hispanic / Latine Led","San Francisco Bay Area, West Coast,"
Meta,—,10001+,"Meta is a social technology company that enables people to connect, find communities, and grow businesses. Previously known as Facebook, Mark Zuckerberg announced the company rebrand to Meta on October 28, 2021 at the company's annual Connect Conference. Facebook was founded by Mark Zuckerberg in Menlo Park, California in 2004. With millions of more users, [Friendster] attempted to acquire the company for $10 million in mid-2004. Facebook turned down the offer and subsequently received $12.7 million in funding from [Accel Partners] at a valuation of around $100 million. Facebook continued to grow opening up to high school students in September 2005 and adding a photo-sharing feature the next month. The next spring, Facebook received $25 million in funding from [Greylock Partners] and [Meritech Capital] as well as previous investors [Accel Partners] and [Peter Thiel]. The pre-money valuation for this deal was about $525 million. Facebook subsequently opened up to work networks eventually amassing over 20,000 work networks. Finally, in September 2006, Facebook was opened to anyone with an email address. Facebook continued to receive funding most notably in January 2011 receiving $1.5 billion and valuing the company at $50 billion. A year later in February 2012, Facebook announced that it was filing for its long-anticipated initial public offering. The company went public on May 18, 2012 opening in [NASDAQ] with shares trading at $42.05. Facebook announced positive numbers in February 2012 upon filing for its IPO. As of July 2013 over 1.15 billion users have logged into Facebook every month and 669 million users daily. Mobile users now make up half of Facebook’s user base with 819 million monthly actives. Facebook is one of the most trafficked sites in the United States. Additionally, Facebook is the top photo-sharing site with 250 million photos uploaded per day. The company has a strategic partnership with AXA Group to develop marketing and commercial collaboration in the digital, social, and mobile sphere. Meta is currently the owner of many applications and services such as Facebook App, Instagram, Whatsapp, Oculus VR, Pagemodo Pagebuilder, [RSS Graffiti], Huddle, and more. Facebook is the world’s largest social network with over 2.9 billion monthly active users.","Menlo Park, California, United States","Feb 4, 2004","Augmented Reality, Social Media,,","Meta is a social technology company that enables people to connect, find communities, and grow businesses.","Aug 4, 2022",Post-IPO Debt,"$10,000,000,000","Microsoft, PayPal, Accel, General Atlantic,",$10B+,—,"San Francisco Bay Area, Silicon Valley,"
SoLo Funds,—,101-250,"SoLo is a financial service provider enabling a marketplace where members can request and fund emergency needs. SoLo launched in 2018 with the goal of providing a lending alternative that was equitable, empowering, and community-driven. Since then, we’ve processed millions of transactions and redefined financial services for our community members. Today, we’re driven to new heights launching banking, credit building and premium member services, but grounded in the same hope and mission: to build a community that enables financial autonomy for all.","Los Angeles, California, United States",Apr 2018,"Banking, Financial Services, FinTech,,",SoLo is a community finance platform where our members step up for one another.,"Mar 3, 2023",Venture - Series Unknown,—,"Techstars, JumpStart, Alumni Ventures,,",$1M to $10M,"Black / African American Founded,,","Greater Los Angeles Area, West Coast,"
Maude,—,11-50,"Launched in April 2018, maude is an essentials brand on a mission to make intimacy better for all people through quality, simplicity, and inclusivity. Working closely with best-in-class factories, each of maude's body-safe products are made to be both easy-to-use and to elevate an everyday experience destigmatizing and modernizing sexual health.","Brooklyn, New York, United States",2017,"Consumer Goods, E-Commerce,,,",Maude is an essentials brand with a focus on access to sexual wellness products.,"Jun 29, 2021",Series A,"$5,800,000","WME, True., Outbound Ventures,,",—,"Hispanic / Latine Founded, Hispanic / Latine Led,,","Greater New York Area, East Coast,"
First Citizens Bank,—,5001-10000,"First Citizens Bank helps customers do more with money. It is a full-service banking institution, Its parent company, First Citizens BancShares, Inc. (NASDAQ: FCNCA), has more than $35 billion in assets. First Citizens is now a family-controlled bank, with a record of stable leadership few institutions can rival. First Citizens Bank provides banking services, essential business and professional services, wealth management capabilities, and a full-service telephone bank and sophisticated online and mobile banking offerings. The company is committed to reflecting the rich diversity of the communities where it does business. It strives to encourage associates to accomplish the full potential by contributing to business success and service excellence. The security of financial information is among the company's priorities. First Citizens Bank was founded on 1898 and is headquartered in Raleigh, North Carolina.","Raleigh, North Carolina, United States",1898,"Banking, Insurance, Lending, Payments,","First Citizens Bank provides banking services, essential business and professional services, wealth management capabilities, and more.","May 7, 2021",Debt Financing,"$10,000,000",—,—,—,"Research Triangle, East Coast,"
AstraZeneca,—,10001+,"AstraZeneca is an innovation-driven biopharmaceutical company specializing in the discovery, development, manufacturing and marketing of prescription medicines that make a meaningful difference in healthcare. AstraZeneca discovers new medicines that are designed to improve the health and quality of life of patients around the world - medicines which are innovative, effective and which offer added benefits such as reduced side effects or better ways of taking the treatment. AstraZeneca focus on getting the best from every medicine they make by exploring all the ways it can be used or improved. AstraZeneca was established on April 6, 1999 in Cambridgeshire, United Kingdom.","Cambridge, Cambridgeshire, United Kingdom","Apr 6, 1999","Biopharma, Biotechnology, Health Care,,","AstraZeneca is a pharmaceutical company that discovers, develops, manufactures, and markets prescription medicines.","Feb 28, 2023",Post-IPO Debt,"$2,250,000,000",—,$1B to $10B,—,—
Starbucks,—,10001+,"Starbucks is an international chain of restaurants that retails handcrafted coffee, tea, and fresh food items. With 23,132 stores in 65 countries and territories, Starbucks locations serve hot and cold drinks, whole-bean coffee, microground instant coffee, espresso, caffe latte, full-leaf teas, evolution fresh juices, pastries, and snacks. Most stores also sell pre-packaged food items, hot and cold sandwiches, and items such as mugs and tumblers. The stores also offer a variety of beers, wines, and appetizers, and markets books, music, and film. Some of the company’s products are seasonal or specific to the locality of the store. Starbucks-brand coffee, ice cream, and bottled cold coffee drinks are also sold at grocery stores. Starbucks was founded by Orin Smith in October 1971 and is based in Seattle, Washington.","Seattle, Washington, United States","Mar 31, 1971","Coffee, Food and Beverage, Restaurants,","Starbucks is an international restaurant chain that retails handcrafted coffee, tea, and fresh food items.","Oct 10, 2018",Post-IPO Equity,"$900,000,000","Upfront Ventures, Pershing Square Capital Management",$1B to $10B,—,"Greater Seattle Area, West Coast,"
Seagen,—,1001-5000,"Seattle Genetics is a clinical-stage biotechnology company that focuses on developing and commercializing monoclonal antibody-based therapies for the treatment of cancer and autoimmune diseases. Its lead product, SGN-35, is in the pivotal trial for patients with relapsed or refractory Hodgkin lymphoma. The company's other product candidates in various stages of clinical trials include dacetuzumab (SGN-40), a humanized anti-CD40 antibody; lintuzumab (SGN-33), a humanized anti-CD33 antibody; SGN-70, a humanized anti-CD70 antibody for the treatment of autoimmune diseases; SGN-75, which is in Phase I clinical trials for metastatic renal cell carcinoma and non-Hodgkin lymphoma; ASG-5ME, a preclinical antibody-drug conjugate product candidate for the treatment of solid tumors; and SGN-19A, a preclinical antibody-drug conjugate product candidate for the treatment of hematologic malignancies. It has collaborations with Bayer Pharmaceuticals Corporation; Celldex Therapeutics, Inc.; Daiichi Sankyo Co., Ltd.; Genentech; GlaxoSmithKline LLC; MedImmune, Inc.; Millennium; PSMA Development Company LLC; and Genmab A/S. The company also has an antibody-drug conjugates co-development agreement with Agensys, Inc. The company was founded in 1997 and is headquartered in Bothell, Washington.","Bothell, Washington, United States",1998,"Biotechnology, Health Care, Pharmaceutical,",Seagen is a clinical-stage biotechnology company dedicated to improving patient outcomes with advanced antibody-drug conjugate technology.,"Sep 14, 2020",Post-IPO Equity,"$1,000,000,000","Merck, Takeda, New Enterprise Associates,",$1B to $10B,—,"Greater Seattle Area, West Coast,"
Stability AI,—,51-100,"Stability AI is an AI-driven visual art startup that designs and implements an open AI tool to create images based on text input given. This tool executes text commands into images and other forms of media using collective intelligence and augmented technology to help clients develop cutting-edge open AI models for image, language, audio, video, 3D, and biology. The company was founded in 2019 and is headquartered in London, England.","London, England, United Kingdom",2019,"Artificial Intelligence, Image Recognition,,",Stability AI is an AI-driven visual art startup that designs and implements an open AI tool to create images based on text input given.,"Oct 12, 2022",Seed,"£89,000,000","Lightspeed Venture Partners, Coatue,,,",—,—,—
Lenovo,—,10001+,"Lenovo is one of the world's leading personal technology companies, producing innovative PCs and mobile internet devices. A global Fortune 500 company, Lenovo is the world's largest PC vendor and fourth largest smartphone company. While the Lenovo brand came into existence only in 2004, the company has a much longer history. In 1984, Legend Holdings was formed with 200,000 RMB (US$25,000) in a guard house in China. The company was incorporated in Hong Kong in 1988 and would grow to be the largest PC company in China. Legend Holdings changed its name to Lenovo in 2004 and, in 2005, acquired the former Personal Computer Division of IBM, the company that invented the PC industry in 1981. Today, Lenovo is a US$39billion personal technology company with more than 54,000 employees (including joint ventures) in more than 60 countries serving customers in more than 160 countries. Lenovo is a global company that is incorporated and headquartered in Hong Kong, with operational centers located strategically around the world , with the largest in Beijing and Morrisville, NC. These operational centers drive Lenovo’s global and local business approach. Lenovo has grown faster than the market for more than four years because our exceptionally engineered products are meant for those who do. Our customers use innovation to bring progress to the world, and we design and build our products with this in mind, taking inspiration from the drive and imagination of the people who make things happen. Our technology helps those who do, do better. Whether a PC, smartphone, tablet, smart TV, server, workstation or storage, Lenovo makes the products that customers need for what we call the ""PC+ world."" Lenovo is creating real differentiation from the competition thanks to its vertically integrated end-to-end business model. This model is unique among major PC makers and is a significant source of competitive advantage, helping us to bring more innovation to market, more efficiently, and aggressively attack the PC+ opportunity. And as Lenovo expands globally, we are establishing even deeper roots in each major market, investing not only in sales and distribution, but also in local domestic manufacturing, R&D and other high-value functions. This global reach with local excellence is enabling us to build a new kind of company - a ""global-local"" company - and positions us to more deeply implement our protect and attack strategy and build the foundation for long-term success.","Beijing, Beijing, China",1984,"Computer, Electronics, Hardware,","Lenovo Group is a computer technology company that manufactures personal computers, smartphones, televisions, and wearable devices.","Oct 3, 2017",Post-IPO Equity,"$500,000,000","TPG, General Atlantic, The Parent Company,,",$10B+,—,Asia-Pacific (APAC)
Silvergate Bank,—,101-250,"Silvergate Capital Corporation (NYSE: SI) is the leading provider of innovative financial infrastructure solutions and services for the growing digital currency industry. The Company’s real-time payments platform, known as the Silvergate Exchange Network, is at the heart of its customer-centric suite of payments, lending and funding solutions serving an expanding class of digital currency companies and investors around the world. Silvergate is enabling the rapid growth of digital currency markets and reshaping global commerce for a digital currency future.","La Jolla, California, United States",1988,"Banking, Finance, Financial Services",Silvergate Capital Corp is a financial infrastructure solutions and services company.,"Jan 20, 2021",Post-IPO Equity,"$287,500,000","Digital Currency Group, CMT Digital Ventures,",$50M to $100M,—,"Greater San Diego Area, West Coast,"
Intel,—,10001+,"Intel is building on its unrivaled history of innovation to power the future of computing and communications. Intel's ambitions? A world that runs on Intel. Intel is doing this by helping its customers find the technologies and solutions that allow them to transform their businesses and gain market advantage. And it all starts with data. Intel is on a journey from a PC-centric company to a data-centric company. Intel's unmatched depth of experience and scope of vision allows it to dream big, to create a world where Intel powers the future of computing and communications—including powerful processors and accelerators that unlock the full potential of data. Intel continuously delivers advances in performance, power, and connectivity across a diversity of data-centric workloads, so its customers can harness the raw power of data. Intel's innovations span architecture, memory, software, and security to help develop transformative products and experiences for its customers. Collectively, Intel's 107,000 employees worldwide are enabling amazing experiences in 5G, artificial intelligence, driverless cars, and much more.","Santa Clara, California, United States","Jul 18, 1968","Artificial Intelligence, Computer,,,,,,,","Intel designs, manufactures, and sells integrated digital technology platforms worldwide.","Feb 22, 2021",Post-IPO Equity,"$10,000,000","Venrock, Arthur Rock & Co, Max Palevsky",$10B+,—,"San Francisco Bay Area, Silicon Valley,"
GitHub,—,1001-5000,"GitHub provides code hosting services that allow developers/people to build software for open source and private projects in organizations. It designs and develops an online platform to allows users to store and share codes repositories with friends, co-workers, classmates, and complete strangers. GitHub has a strategic partnership with International Business Machines Corporation. It was founded on February 29, 2008, by Chris Wanstrath, PJ Hyett, and Tom Preston-Werner, with its headquarters in San Francisco in California.","San Francisco, California, United States","Feb 29, 2008","Cloud Computing, Developer Tools,,,",GitHub provides code hosting services that allow developers to build software for open-source and private projects in organizations.,"Jul 28, 2016",Series B,—,"Sequoia Capital, Andreessen Horowitz,,,",$100M to $500M,—,"San Francisco Bay Area, West Coast,"
Google,—,10001+,"Google is a multinational technology company focusing on search engine technology, online advertising, cloud computing, computer software, quantum computing, e-commerce, artificial intelligence, and consumer electronics. Their products address a wide range of use cases, including email, navigation, cloud computing, web browsing, video sharing, productivity, operating systems, cloud storage, language translation, photo storage, video calling, smart home, smartphones, wearable technology, music streaming, and more.","Mountain View, California, United States",1998,"Advertising, Collaboration, Enterprise Software,,",Google is a multinational corporation that specializes in Internet-related services and products.,"Jun 7, 1999",Series A,"$25,000,000","Sequoia Capital, Kleiner Perkins,,,",$10B+,—,"San Francisco Bay Area, Silicon Valley,"
Tencent,—,10001+,"Tencent is an internet service portal offering value-added internet, mobile, telecom, and online advertising services. Its communications and social platforms Weixin and QQ connect users with each other, with digital content and daily life services in just a few clicks. Tencent has maintained steady growth under its user-oriented operating strategies. It provides value-added internet, mobile, and telecom services, as well as online advertising under the strategic goal of providing users with ""one-stop online lifestyle services."" Tencent’s Internet platforms in China – QQ (QQ Instant Messenger), WeChat, QQ.com, QQ Games, Qzone, 3g.QQ.com, SoSo, PaiPai, and Tenpay – aim to address the various needs of internet users, including communication, information, entertainment, e-commerce, and others. In September 2013, Tencent's market valuation rose to $101 billion, and as of November 21, 2013, QQ had 2 billion active users and WeChat had 650 million monthly active users. The numbers of active users for QQ mail, Qzone, Tencent Weibo, and QQ news were 274 million, 626 million, 220 million, and 150 million, respectively. Tencent was founded in November of 1998. In April 2000, the IDG and PCCW invested a total of $2.2 million dollars in the company. Tencent was listed on the Hong Kong Stock Exchange (SEHK) on June 16, 2004. Baidu, Alibaba, and Netease are Tencent's major competitors.","Shenzhen, Guangdong, China","Nov 1, 1998","Advertising, Internet, Online Games,,","Tencent is an internet service portal offering value-added internet, mobile, telecom, and online advertising services.","May 29, 2020",Post-IPO Debt,"$6,000,000,000","IDG Capital, Lippo Group, PCCW,",$10B+,—,Asia-Pacific (APAC)
OurCrowd,—,101-250,"OurCrowd is a venture investing platform that enables institutions and individuals to invest and engage in emerging companies. OurCrowd was started in 2013, driven by the idea that the business of building startups grows bigger and better when the global 'crowd' gains access to VC-level investment opportunities.","Jerusalem, Yerushalayim, Israel","Feb 1, 2013","Angel Investment, Crowdfunding,,,",OurCrowd is a venture investing platform that enables institutions and individuals to invest and engage in emerging companies.,"Oct 27, 2021",Private Equity,"$25,000,000","United Overseas Bank, SoftBank Vision Fund,,,",$50M to $100M,—,—
Skydio,Yes,501-1000,"Skydio is a drone manufacturer that uses artificial intelligence to create flying drones that are used by consumers, enterprises, and government customers. It develops AI-powered drones to deliver the power and flying cameras without the complexity. The company's drones use an array of cameras and proprietary computer vision technology to recognize, avoid objects in real-time, and predict into the future to make intelligent decisions, enabling users by flying themselves through the most demanding tasks or keeping them safe from obstacles when they want to take control. The company's debut drone, the R1, could track a target and film them while avoiding obstacles without any human intervention required. Then the company released the Skydio 2 in 2019, its second drone, cutting off more than half the price while improving it its autonomous tracking and video capabilities. Its flagship product, the X2, is equipped with seven cameras, 100x zoom, night vision, and promises to turn ordinary users into expert pilots thanks to its self-piloting abilities. It is backed by top investors and strategic partners including Andreessen Horowitz, Linse Capital, Next47, IVP, Playground, NVIDIA, and UP.Partners. Abraham Bachrach, Adam Bry, and Matt Donahoe founded Klarna in Redwood City, California in 2014.","Redwood City, California, United States",2014,"Artificial Intelligence, Drone Management,,,","Skydio uses artificial intelligence to create flying drones that are used by consumer, enterprise, and government customers.","Feb 27, 2023",Series E,"$230,000,000","NVIDIA, Axon, Hercules Capital,,",—,—,"San Francisco Bay Area, Silicon Valley,"
Block,—,5001-10000,"Block builds tools to help expand access to the economy. Global technology company Block specializes in financial services. It consists of Square, Cash App, Spiral, TIDAL, and TBD, creating solutions to increase access to the economy.","San Francisco, California, United States",2009,"Business Development, Finance,,",Block builds tools to help expand access to the economy.,"Sep 14, 2014",Series E,"$150,000,000",Cota Capital,—,—,"San Francisco Bay Area, West Coast,"
Strangeworks,—,11-50,Strangeworks makes the power of quantum computing accessible to everyone all in one place. Learn more at http://quantumcomputing.com,"Austin, Texas, United States",2018,"Quantum Computing, Software",Strangeworks makes the power of quantum computing accessible to everyone all in one place. Learn more at http://quantumcomputing.com,"Mar 21, 2023",Series A,"$24,000,000","Lightspeed Venture Partners, IBM,,,",—,"Hispanic / Latine Founded, Hispanic / Latine Led",Southern US
