Sonder,—,501-1000,"Sonder is revolutionizing hospitality through innovative, tech-powered service and inspiring, thoughtfully designed accommodations combined into one seamlessly managed experience. Officially launched in 2014 and headquartered in San Francisco, Sonder is making a world of better stays open to all with a variety of accommodation options — from rooms to suites and apartments — found in more than 30 cities spanning eight countries and three continents. Sonder’s innovative app empowers guests by making self-service features and 24/7 on-the-ground support just a tap away. From simple self check-in to boutique bathroom amenities, we bring the best of a hotel without any of the formality.","San Francisco, California, United States",Jul 2014,"Hospitality, Tourism, Travel",Sonder is a tech-driven hospitality company offering spaces built for travel and life in cities around the world.,"Jan 19, 2022",Post-IPO Equity,"$310,000,000","BlackRock, Fidelity, Valor Equity Partners,,",$100M to $500M,—,"San Francisco Bay Area, West Coast,"
Fazz,—,501-1000,"Fazz enables merchants from SMEs to Enterprises to accept payments, transfer, bank, and invest. The firm offers Fazz Agen, an agent-based financial application serving micro and small businesses in Indonesia. Fazz Business is a business account to help startups, MSMEs, and large corporations build, run, and grow their businesses across Southeast Asia by providing the ability to pay and receive payments, grow capital, and get funding. The company was founded in 2016 and is based in Singapore and Indonesia. PayFazz and Xfers merged and formed Fazz.","Singapore, Central Region, Singapore","May 18, 2016","Banking, Financial Services, FinTech,,","Fazz enables businesses to send and receive payments, grow their capital, and get funding.","Mar 3, 2023",Venture - Series Unknown,"$5,300,000","Y Combinator, Lendable, Tiger Global Management,,",—,—,"Asia-Pacific (APAC), Association of Southeast Asian Nations (ASEAN),"
Devo,—,251-500,"Devo is the only cloud-native logging and security analytics platform that releases the full potential of your data to empower bold, confident action. With unrivaled scale to collect all of your data without compromise, speed to give you immediate access and answers, and clarity to focus on the signals that matter most, Devo is your ally in protecting your organization today and tomorrow. Headquartered in Cambridge, Mass., Devo is backed by Insight Partners, Georgian, TCV, General Atlantic, Bessemer Venture Partners, Kibo Ventures and Eurazeo. Devo Technology was founded in 2011 and is headquartered in Cambridge, Massachusetts.","Cambridge, Massachusetts, United States","May 1, 2011","Analytics, Big Data, Cloud Data Services,,,",Devo is a cybersecurity company that provides cloud-native logging and security analytics for organizations.,"Jun 2, 2022",Series F,"$100,000,000","Eurazeo, General Atlantic, Insight Partners,,",$1M to $10M,Hispanic / Latine Founded,"Greater Boston Area, East Coast,"
Coincover,—,51-100,"Coincover is a cryptocurrency insurance-backed technology that helps protect digital assets from hacks and human error. Protection provides safety against the loss or theft of crypto assets, and fraudulent transactions. Coincover Protection provides end-users unparalleled safety against the loss or theft of crypto assets, and fraudulent transactions, ensuring assets are both safe and accessible. Coincover Protect delivers through a key combination of technology solutions Cryptocurrency Theft cover: protecting end-users against cryptocurrency theft from phishing, hacking and cyber attacks to criminal extortion. If the worst does happen, Coincover will retrieve the value of crypto funds fast. With no deductible, the full value of crypto is returned. Deposit Protection Guarantee: protection for end-user cryptocurrency deposits against lost access; including password, device and key loss as well as through business failure. Funds are guaranteed to always be accessible. Transaction Checker: real time transaction monitoring for crypto assets to ensure genuine transactions. Coincover identifies, investigates and flags any suspicious transactions in real time so end-users never need worry about theft of crypto funds.","Cardiff, Cardiff, United Kingdom",May 2018,"Blockchain, Cryptocurrency, Financial Services,,",Coincover is a cryptocurrency insurance-backed technology that helps protect digital assets from hacks and human error.,"Feb 9, 2023",Series B,"$30,000,000","Valor Equity Partners, Insurtech Gateway,,,",—,—,—
Medium,Yes,101-250,"Medium is a social publishing platform that allows anyone to share ideas and perspectives that matter. For writers, Medium offers simple creation tools combined with a larger distribution network. For readers, Medium allows people to follow people and topics that matter to them and receive a personalized feed of content every day. Readers can join in the conversation by highlighting, recommending, or responding to posts. It was founded n 2013 and headquartered in San Francisco, California.","San Francisco, California, United States","Jul 18, 2011","Internet, News, Publishing, Tour Operator,",Medium is a social publishing network that connects ideas and perspectives on topics that matter.,"Nov 18, 2021",Venture - Series Unknown,"$30,967,569","Andreessen Horowitz, Google Ventures,,,",$10M to $50M,—,"San Francisco Bay Area, West Coast,"
HelloSelf,—,51-100,"HelloSelf provides online counselling and life coaching services to help people cope with stress. The company's services include elements such as stress, anxiety, and confidence testing using professionally proven procedures, allowing patients to schedule appointments with psychologists and therapists at their leisure. HelloSelf was established in 2018 in London, England by Charles Wells.","London, England, United Kingdom",2018,"Health Care, Personal Health,",HelloSelf is a health and wellness platform that provides its users with digital access to therapists.,"Mar 14, 2023",Series B,"$20,000,000","Google for Startups, Octopus Ventures,,,",—,—,—
HUB Security,—,501-1000,HUB Security was established in 2017 by veterans of the 8200 and 81 elite intelligence units of the Israeli Defense Forces. The company specializes in unique Cyber Security solutions protecting sensitive commercial and government information. The company debuted an advanced encrypted computing solution aimed at preventing hostile intrusions at the hardware level while introducing a novel set of data theft prevention solutions. HUB operates in over 30 countries and provides innovative cybersecurity computing appliances as well as a wide range of cybersecurity professional services worldwide.,"Tel Aviv, Tel Aviv, Israel","Nov 1, 2017","Cloud Computing, Cloud Security,,,,,",HUB Security is redefining cyber security with quantum driven confidential computing,"Mar 15, 2023",Post-IPO Equity,"$20,000,000","OurCrowd, AXA Venture Partners,",$1M to $10M,—,—
Redis,—,501-1000,"Redis makes apps faster, by creating a data layer for a real-time world. We are the sponsor of the open source Redis project, the world’s most loved in-memory database, and deliver Redis Enterprise, a real-time data platform. Developers rely on Redis to build performance, scalability, reliability, and security into their applications. Born in the cloud-native era, Redis uniquely enables users to unify data across multi-cloud, hybrid and global applications to maximize business potential.","Mountain View, California, United States",2011,"Analytics, Big Data, Cloud Data Services,,,,,",Redis is the sponsor of the open source database and delivers an enterprise-grade data platform to power real-time experiences.,"Dec 16, 2021",Secondary Market,"$1,200,000","Francisco Partners, Silicon Valley Bank,,,",$10M to $50M,—,"San Francisco Bay Area, Silicon Valley,"
JD.com,Yes,10001+,"JD.com is an online direct sales company in China in terms of transaction volume, with a market share in China of 54.3% in the second quarter of 2014, according to iResearch, a third-party market research firm. JD.com believes they provide consumers an enjoyable online retail experience. Through their content-rich and user-friendly website www.JD.com and mobile applications, JD.com offers a wide selection of authentic products at competitive prices which are delivered in a speedy and reliable manner. JD.com also offer convenient online and in-person payment options and comprehensive customer services. In order to have better control over fulfillment and to ensure customer satisfaction, JD.com has built their own nationwide fulfillment infrastructure and last-mile delivery network, staffed by their own employees, which supports both their online direct sales and their online marketplace businesses. JD.com has established strong relationships with their suppliers as they develop their online direct sales business. Leveraging their strengths, they launched their online marketplace business in 2010, which has allowed us to significantly expand their selection of products and services. Timely and reliable fulfillment is critical to the success of an online retail business. JD.com believes that they have the largest fulfillment infrastructure of any e-commerce company in China. As of June 30, 2014, JD.com operated 97 warehouses with an aggregate gross floor area of approximately 1.8 million square meters and 1,808 delivery stations and 715 pickup stations. As of June 30, 2014, their self-operated delivery network covered 1,780 counties and districts and their 211 program and next-day delivery program covered 111 and 622 counties and districts, respectively, across China. JD.com has 62,061 full-time employees as of July 31, 2014. JD.com is a technology-driven company and has invested heavily in developing their own highly scalable proprietary technology platform that supports their rapid growth and enables us to provide value-added technology services.","Beijing, Beijing, China","Jun 6, 1998","E-Commerce, Internet, Logistics,,,",JD.com is an internet company and online consumer electronics retailer in China.,"Dec 28, 2021",Post-IPO Debt,"$2,000,000,000","Google, Kingdom Holding Company,,,",$10B+,—,Asia-Pacific (APAC)
State Bank of India,—,10001+,"The State Bank of India (SBI) is an Indian multinational, public sector banking and financial services company. It is a government-owned corporation headquartered in Mumbai, Maharashtra. The company is ranked 216th on the Fortune Global 500 list of the world's biggest corporations as of 2017. It is the largest bank in India with a 23% market share in assets, besides a share of one-fourth of the total loan and deposits market.","Mumbai, Maharashtra, India","Jan 1, 1955","Banking, Finance, Financial Services","The State Bank of India (SBI) is an Indian multinational, public sector banking and financial services company.","Mar 9, 2023",Post-IPO Debt,"₹37,170,000,000",—,—,—,Asia-Pacific (APAC)
Pismo,—,101-250,"Pismo is a technology company providing an all-in-one processing platform for banking, payments, and financial markets infrastructure. Large banks, marketplaces, and fintech already use our cloud-native microservices platform. Pismo clients are launching next-generation solutions while migrating their legacy systems onto the most advanced platform in the market. Pismo cloud-based platform empowers teams to build fast and companies to launch rapidly, scaling as they grow to have a broader audience while keeping high security and availability standards.","Bristol, Bristol, City of, United Kingdom","Dec 1, 2016","Banking, Cloud Computing, FinTech,,,",Next-gen banking and payments at hyperscale.,"Oct 19, 2021",Series B,"$108,000,000","Amazon, Accel, Headline, SOFTBANK Latin America Ventures,",—,—,—
Equinix,—,10001+,"Equinix is an internet company that provides data center services for companies, businesses, and organizations. It offers a software application platform designed for digital businesses that help its users to connect to their customers, employees, and partners. The company was founded in 1998 and headquartered in Redwood City, California.","Redwood City, California, United States",1998,"Cloud Data Services, Data Center,,,,","Equinix is an internet company that provides data center services for companies, businesses, and organizations.","Jan 9, 2017",Post-IPO Debt,"€1,000,000,000","Microsoft, Ameriprise Financial,,,",$1B to $10B,—,"San Francisco Bay Area, Silicon Valley,"
Heineken,—,10001+,"Heineken is a global brewer that markets premium beers and cider brands. Established in 1864 by the Heineken family, HEINEKEN has a long and proud history and heritage as an independent global brewer. Today, HEINEKEN is the number one brewer in Europe and the number three brewer by volume in the world. With recent acquisitions in Africa, India, Asia and Latin America, they are continuing to increase their presence within emerging markets, which will contribute to their ongoing growth.","Amsterdam, Noord-Holland, The Netherlands",1863,"Brewing, Craft Beer, Food and Beverage,",Heineken is a global brewer that markets premium beers and cider brands.,"Feb 23, 2023",Post-IPO Equity,"$902,000,000",Bill Gates,$1B to $10B,—,European Union (EU)
New York State,—,51-100,"New York State is a diverse agency in state government that works to make New York a more welcoming, equitable, and prosperous place. New York State has resources for New Yorkers in need.","New York, New York, United States",1968,"Association, Consumer, Government,,,,,,","New York State is a diverse agency in state government that works to make New York a more welcoming, equitable, and prosperous place.","Mar 3, 2016",Venture - Series Unknown,"$20,000,000",—,$1B to $10B,—,"Greater New York Area, East Coast,"
Grab,—,10001+,"Grab operates a mobile technology platform that integrates city transportation for driver-partners and customers in South East Asia. It offers services like GrabTaxi, GrabCar, GrabHitch, GrabShare, GrabCoach, GrabShuttle, GrabShuttle Plus, GrabFamily, JustGrab, GrabNow, and GrabRental. Grab offers services in Singapore, Indonesia, Philippines, Malaysia, Thailand, Vietnam, and Myanmar. Anthony Tan and Tan Hooi Lng founded it in 2012 and is headquartered in Singapore. It has additional offices in Seattle, Beijing, Bangalore, Jakarta, and Vietnam.","Singapore, Central Region, Singapore",Jun 2012,"Apps, Car Sharing, Food Delivery,,","Grab is an application that provides transportation, logistics, and financial services.","Dec 2, 2021",Post-IPO Equity,"$4,000,000,000","500 Global, Microsoft, HSBC, SoftBank,",$100M to $500M,—,"Asia-Pacific (APAC), Association of Southeast Asian Nations (ASEAN),"
Highspot,—,501-1000,"Highspot is an AI-fueled sales enablement platform that helps companies worldwide improve the performance of their sales teams. Its platform specializes in providing intelligent content management, training, contextual guidance, customer engagement, and actionable analytics. Its unified sales enablement platform gives revenue teams a single solution to elevate customer conversations and drive repeatable revenue, bringing together native content and guidance, training and coaching, and engagement intelligence – all supported by actionable analytics. The company was founded in 2012 and headquartered in Seatle, Washington.","Seattle, Washington, United States",2012,"Artificial Intelligence, Enterprise Software,,",Highspot is an AI-fueled sales enablement platform that helps companies worldwide improve the performance of their sales teams.,"Jul 1, 2022",Secondary Market,—,"Acequia Capital (AceCap), Madrona,,,",$1M to $10M,—,"Greater Seattle Area, West Coast,"
Chronosphere,—,251-500,"Chronosphere is an observability platform that empowers cloud native engineering organizations to control for data volumes, rampant costs and organizational friction that comes from rapid scale and technical complexity. Chronosphere is a Series C startup with more than $255M in funding and backed by VC firms Greylock, Lux Capital General Atlantic, Founder Fund, Spark Capital, and investor Lee Fixel.The team is distributed with major hubs in New York and Vilnius.","New York, New York, United States",2019,"Analytics, Cloud Infrastructure,,,","Chronosphere develops a scalable, reliable, and customizable monitoring solution built for cloud-native applications.","Jan 9, 2023",Series C,"$115,000,000","Google Ventures, General Atlantic,,,",—,—,"Greater New York Area, East Coast,"
Andreessen Horowitz,—,251-500,"Andreessen Horowitz is a venture capital firm specializing in investing in seed, start-ups, early, mid stage, growth, and late stage. It prefers to invest in the social media business and technology sector with a focus on software, back-end infrastructure, infrastructure of the Internet, cloud computing, enterprise software and services, consumer, business Internet, mobile-Internet, consumer Internet, cloud computing, data-storage, social network browsers data-storage, consumer electronics, networking functions, software related biology, biotech, and medicine companies at the intersection of computer science and life sciences with a focus on digital therapeutics, cloud technology in biology, and computational medicine.","Menlo Park, California, United States",Jun 2009,"Angel Investment, Finance, Financial Services,,",Andreessen Horowitz is a stage-agnostic venture capital firm with assets under management across multiple funds.,—,—,—,—,$50M to $100M,—,"San Francisco Bay Area, Silicon Valley,"
Greenlight,—,501-1000,"Greenlight is a debit card and money app that provides an all-in-one money management platform for families and parents. Millions of parents and kids use Greenlight to earn, save, spend wisely, give, and invest. Parents can set flexible spending controls, manage chores, automate allowances, and invest for their kids’ futures. It offers up to 3% unlimited cash back on all purchases and gives parents the option to automatically invest those cash rewards in stocks and ETFs to spend on family-related expenses. Greenlight was founded in 2014 and is based in Atlanta, GA.","Atlanta, Georgia, United States",2014,"Banking, Debit Cards, Financial Services,,",Greenlight is a debit card and money app that provides an all-in-one money management platform for families and parents.,"Apr 27, 2021",Series D,"$260,000,000","Andreessen Horowitz, JPMorgan Chase & Co.,,,",$10M to $50M,—,"Greater Atlanta Area, East Coast,"
