Organization Name,Actively Hiring,Number of Employees,Full Description,Headquarters Location,Founded Date,Industries,Description,Last Funding Date,Last Funding Type,Last Funding Amount,Top 5 Investors,Estimated Revenue Range,Diversity Spotlight (US Headquarters Only),Headquarters Regions
Origis Energy,Yes,51-100,"Origis Energy is a solar development and construction firm that brings clean solar and energy storage solutions to utility, commercial, and industrial sectors. The company provides solar and energy storage development, financing, engineering, procurement, and construction (EPC), as well as operations and asset management. Origis Energy was established in 2008 in Miami, Florida by Guy Vanderhaegen.","Miami, Florida, United States",2008,"Clean Energy, Energy, Renewable Energy,",Origis Energy is a solar development and construction firm that provides clean solar and energy storage solutions.,"Mar 7, 2023",Debt Financing,"$750,000,000","Deutsche Bank, HSBC, First Citizens Bank,,",$10M to $50M,—,"Greater Miami Area, East Coast,"
Bach,—,11-50,"Bach solves the myriad pain points behind coordinating group travel, allowing groups to discover, decide, and plan in one place, complete with a marketplace for bookable experiences and critical features including group chat, expense splitting, polling, and itinerary creation.","New York, New York, United States","Mar 10, 2018","Events, Internet",BACH is a group travel app for bachelor/ette parties to plan and book incredible experiences,"Mar 9, 2023",Series A,"$9,000,000","Alumni Ventures, Corazon Capital,,,",$1M to $10M,—,"Greater New York Area, East Coast,"
Francisco Partners,—,101-250,"Francisco Partners is a global investment firm that specializes in partnering with technology and technology-enabled businesses. With $7 billion of capital under management, Francisco Partners is one of the world's largest technology-focused private equity funds. The firm was founded to pursue structured investments in technology companies undergoing strategic, technological, and operational inflection points. Francisco Partners targets control investments in private companies, with transaction values ranging from $30 million to $2 billion. The principals of Francisco Partners have invested in excess of $3 billion of equity capital in over 50 technology companies.","San Francisco, California, United States",1999,"Financial Services, Information Technology,",Francisco Partners is a global investment firm that specializes in partnering with technology and technology-enabled businesses.,"Jul 13, 2018",Corporate Round,—,"Goldman Sachs Asset Management,",$100M to $500M,—,"San Francisco Bay Area, West Coast,"
Zellerfeld Shoe,—,11-50,"Zellerfeld Shoe democratizes shoe manufacturing that produces a whole 3D-printed shoe with the push of a button. They develop their printing technology in-house and are continually challenging the current quo in order to bring about long-overdue reform in an undemocratic and immoral footwear business. The company was founded in 2020 and is based in Brooklyn, New York, United State.","Brooklyn, New York, United States","May 1, 2020","3D Printing, Manufacturing, Mechanical Engineering",Zellerfeld Shoe democratizes shoe manufacturing that produces a whole 3D-printed shoe with the push of a button.,"Feb 23, 2023",Seed,"$15,000,000","Founders Fund, Electric Feel Ventures",—,—,"Greater New York Area, East Coast,"
Happilo,—,101-250,"Happilo operates as a healthy food brand. Happilo brings to you an exclusive range of nuts, dried fruits, organic seeds, dry roasted snacks, trial mixes, festive gift hampers, and more.","Bangalore, Karnataka, India",2016,"Food and Beverage, Personal Health,",Happilo operates as a healthy food brand.,"Feb 21, 2022",Venture - Series Unknown,"$25,000,000","Motilal Oswal Private Equity, A91 Partners",$1M to $10M,—,Asia-Pacific (APAC)
Allianz,—,10001+,"Allianz offers a comprehensive range of insurance and asset management products and services to approximately 78 million customers in more than 70 countries. Their product portfolio includes a wide range of property-casualty and life/health insurance products for both private and corporate customers. They are the leading property-casualty insurer globally and rank among the top five in the life/health insurance business. Most of their insurance markets are served by local Allianz companies while selected business lines are run globally such as Global Corporate Customers, Credit Insurance, Assistance Services, Worldwide Care, Global Automotive, and Reinsurance.","München, Bayern, Germany",1890,"Asset Management, Financial Services,,","Allianz is an integrated financial services company offering a range of products, services, and solutions in insurance and asset management.","Apr 16, 2018",Post-IPO Equity,"$85,000,000",JD.com,$1M to $10M,—,European Union (EU)
DragonflyDB,—,1-10,—,"Tel Aviv, Tel Aviv, Israel",2022,Software,DragonflyDB is the fastest memory store in the universe.,"Mar 21, 2023",Series A,"$21,000,000","Quiet Capital, Redpoint",—,—,—
Arrival,—,1001-5000,"Arrival is a technology company that develops a generation of two electric vehicles. It develops software, materials, components, and scalable skateboard platforms and its micro-factories allow them to make vehicles and adapt to any mobility ecosystem. It is a zero-emission solution for cities and a human-centered, intelligent design to revitalize public transportation. The company’s new method uses low CapEx, rapidly scalable Microfactories that can be placed anywhere in the world to serve the regions they are located in. It was founded in 2015 and is headquartered in London, England.","London, England, United Kingdom",2015,"Automotive, Autonomous Vehicles,","Arrival is a developer and manufacturer of zero-emission, public transportation vehicles.","Mar 13, 2023",Post-IPO Equity,"$300,000,000","BlackRock, Wellington Management,,,",$100M to $500M,—,—
BuzzFeed,—,1001-5000,"BuzzFeed is a news and entertainment company that is redefining online advertising with its social, content-driven publishing technology. BuzzFeed provides the most shareable breaking news, original reporting, entertainment, and video across the social web to its global audience of more than 200M. It covers breaking news, produces original videos, and creates content that people want to share on the web. BuzzFeed was founded in 2006 by Jonah Peretti and John Johnson. It is headquartered in New York, New York.","New York, New York, United States",Nov 2006,"Advertising, Digital Entertainment,,,",BuzzFeed is a cross-platform digital media company delivering news and entertainment content to a global audience.,"Dec 3, 2021",Post-IPO Debt,"$150,000,000","Andreessen Horowitz, Lerer Hippeau,,,",$100M to $500M,—,"Greater New York Area, East Coast,"
98point6,—,251-500,"98point6 is a digital primary care service that delivers personalized consultation, diagnosis, and treatment to patients. The company combines deep technology with the expertise of board-certified physicians to provide text-based primary care anytime, anywhere. The company meets consumers where they are by offering private, text-based diagnosis and treatment via a mobile app. The company was founded in 2015 and is headquartered in Seattle, Washington.","Seattle, Washington, United States",Mar 2015,"Health Care, Health Diagnostics,,,","98point6 is a digital primary care service that provides personalized consultation, diagnosis, and treatment to patients.","Sep 1, 2022",Convertible Note,"$20,000,000","Goldman Sachs, L Catterton, Activant Capital,,",$10M to $50M,—,"Greater Seattle Area, West Coast,"
Branch,—,251-500,"Branch is a developer of deep linking technology used to gain and retain mobile app users. Its deep linking technology is used to build user-to-user referral programs with features, including rewarded referrals, content sharing, deep-views, download banner, and personal onboarding that enable users to customize the whole app experience that makes discovering apps and app content easier. Branch was founded in 2014 and is headquartered in Palo Alto, California.","Palo Alto, California, United States","Apr 15, 2014","App Marketing, Mobile Advertising,,",Branch helps companies drive seamless mobile experiences through its linking infrastructure powering thousands of today's top brands.,"Feb 10, 2022",Series F,"$300,000,000","Madrona, Samsung NEXT, New Enterprise Associates,,",$10M to $50M,Women Founded,"San Francisco Bay Area, Silicon Valley,"
CCP Games,—,251-500,"CCP Games is an independent developer of massively multiplayer online (MMO) games. They are creators of boundless and fascinating universes. Their products feature EVE Online, Project M5, and FPS projects. Since the launch of EVE Online in May 2003, CCP has established itself as a company in the field, winning numerous awards and receiving critical acclaim worldwide.","Reykjavík, Gullbringusysla, Iceland","Jun 1, 1997","MMO Games, Online Games, Video Games",CCP Games is an independent developer of massively multiplayer games (MMO).,"Mar 21, 2023",Venture - Series Unknown,"$40,000,000","Andreessen Horowitz, General Catalyst,,,",$10M to $50M,—,"Nordic Countries, Scandinavia"
Mantra Health,—,11-50,"Mantra Health is a digital mental healthcare company designed for all university students. Using its proprietary Collaboration Portal, Mantra develops custom, integrated telemental health programs that improve clinical outcomes and reduce time to access care for universities of all sizes.","New York, New York, United States","Oct 30, 2018","Health Care, Medical, Wellness",Mantra Health is a digital mental healthcare company designed for all university students.,"Mar 27, 2023",Series A,"$5,000,000","Alumni Ventures, HOF Capital,,,",—,—,"Greater New York Area, East Coast,"
VPBank,—,10001+,"VPBank offers insurance, personal services, loans, electronic banking, and other products and services. VPBank is a joint-stock commercial bank in Vietnam. VPBank has achieved steady development throughout its history. Especially since 2010, VPBank has grown dramatically with the development and implementation of the strategic transformation program, with diligent support from consulting companies.","Hanoi, NA - Vietnam, Vietnam",1993,"Banking, Employee Benefits, Financial Services","VPBank offers insurance, personal services, loans, electronic banking, and other services.","Mar 27, 2023",Post-IPO Equity,"₫35,900,000,000,000","International Finance Corporation,",—,—,"Asia-Pacific (APAC), Association of Southeast Asian Nations (ASEAN),"
Dropbox,Yes,1001-5000,"Dropbox provides secure file sharing, collaboration, and storage solutions. Dropbox is to unleash the world’s creative energy by designing a more enlightened way of working.","San Francisco, California, United States","Jun 1, 2007","Collaboration, Enterprise Software,,,","Dropbox is a smart workspace company that provides secure file sharing, collaboration, and storage solutions.","Mar 30, 2017",Debt Financing,"$600,000,000","Deutsche Bank, JP Morgan Chase,,,",$100M to $500M,—,"San Francisco Bay Area, West Coast,"
Apollo.io,—,251-500,"Apollo.io is a B2B sales intelligence and engagement platform, trusted by over 160,000 companies and more than one million users globally, from rapidly growing startups to some of the world's largest enterprises. Apollo.io provides sales teams with easy access to contact data for over 220 million contacts, along with tools to engage with these contacts in one single platform. By helping sales professionals find the most accurate contact information and automating the outreach process, Apollo.io turns prospects into customers. It was founded in 2015 and is based in San Francisco, California.","San Francisco, California, United States",2015,"Lead Generation, Sales, Sales Automation,",Apollo.io provides a foundation for end-to-end sales strategies by providing a data platform for built-in integrations.,"Mar 3, 2022",Series C,"$110,000,000","Sequoia Capital, Y Combinator,,,",$1M to $10M,—,"San Francisco Bay Area, West Coast,"
SITA,—,1001-5000,"SITA is an air transport information technology and communications specialist, providing IT and telecommunication services to the air transport industry. Its IT and communication solutions are used by airlines, airports, governments, air cargo, aerospace, and international organizations. Almost every airline and airport in the world collaborates with SITA and relies on its expertise. Its strategic direction, developments, and innovations are driven by industry requirements. SITA currently serves around 450 members worldwide. SITA is guided by the expertise and experiences of the SITA Board and SITA Council.  The services provided by the company include managed global communications, infrastructure, and outsourcing services. It also assists its customers by providing services for airline commercial management, passenger operations, flight operations, aircraft operations, air-to-ground communications, airport management and operations, baggage operations, transportation security and border management, cargo operations, and more.","Cointrin, Geneve, Switzerland",1949,"Aerospace, Information Technology,,","SITA is an air transport IT and communications specialist, providing IT and telecommunication services to the air transport industry.","Jul 7, 2022",Debt Financing,"$400,000,000",—,$1B to $10B,—,—
Flutura,—,51-100,"Flutura is an AI Solutions company focused on improving two core business objectives of ""Asset Uptime"" and ""Operational Efficiency"". Flutura does this with Cerebra, their AI Platform tuned for IIOT in Oil & Gas, Process Manufacturing, and Heavy machinery manufacturing industries, powering connected asset and connected operations use cases.","Houston, Texas, United States",2012,"Artificial Intelligence, Business Information Systems,,,,,,",Flutura is an AI solutions company focused on improving two core business objectives - “Asset Uptime” and “Operational Efficiency” .,"Feb 3, 2022",Non-equity Assistance,—,"Vertex Ventures, Vertex Ventures Southeast Asia & India,,,",$10M to $50M,—,"Greater Houston Area, Southern US"
Reliance Retail,—,10001+,"Since its inception in 2006, Reliance Retail Limited (RRL) has grown into an organization that caters to millions of customers, thousands of farmers, and vendors. Based on its core growth strategy of backward integration, RRL has made rapid progress towards building an entire value chain starting from the farmers to the end consumers. Reliance Retail continued to expand the presence of its value and specialty formats. During the year, Reliance Retail opened 90 new stores spanning across 'value' and 'specialty' segments. In-store initiatives, wider product choice, and value merchandizing enabled the business to achieve robust growth during this period.","Mumbai, Maharashtra, India",2006,"Consumer Goods, Grocery, Retail","Reliance Retail offers online shopping and a chain of neighborhood stores, supermarkets, and wholesale/specialty stores.","Nov 6, 2020",Private Equity,"₹95,550,000,000","Silver Lake, Saudi Arabia's Public Investment Fund,,,",$10B+,—,Asia-Pacific (APAC)
Dish Network,—,10001+,"Dish Network is a satellite service provider that offers satellite television, audio programming, and interactive television services. The company operates through two segments, DISH and Wireless, and provides video services under the DISH brand. Its programming packages include regional and specialty sports channels, premium movie channels, and Latino and international programming through national broadcast networks, local broadcast networks, national and regional cable networks; and receiver systems. Additionally, Dish Network provides satellite broadband services, wireline voice, and broadband services under the dishNET brand; and linear streaming OTT services, which include news and children’s programs as well as a video-on-demand programming library. The company also offers dishanywhere.com and mobile applications for smartphones and tablets to view authorized content, search program listings, and remotely control features of their digital video recorders. Its Dishanywhere.com and mobile applications provide access to approximately 80,000 movies, television shows, clips, and trailers. Further, it has wireless spectrum licenses and related assets and offers receiver systems and programming through direct sales channels, small satellite retailers, direct marketing groups, local and regional consumer electronics stores, nationwide retailers, and telecommunications companies. Dish Network was founded by Charlie Ergen in 1980 and is based in Englewood, Colorado.","Englewood, Colorado, United States",1980,"Audio, Satellite Communication,,",DISH Network provides television entertainment and technology to customers with its satellite DISH TV and streaming SLING TV services.,"Jan 17, 2023",Post-IPO Debt,"$1,500,000,000",—,$1M to $10M,—,"Greater Denver Area, Western US"
Quantive,—,251-500,"Quantive (formerly Gtmhub) is the world’s leading Strategy Execution Platform based on the OKR management methodology. By embedding strategic context, priorities, and progress into the day-to-day, Quantive creates organizations that excel at execution. With over 2,000 global customers across enterprises, not-for-profits, startups, and governments, Quantive helps today's businesses accelerate growth and transformational change by creating better visibility and organizational alignment.","Denver, Colorado, United States","Jul 7, 2015","Business Intelligence, Enterprise Software,,",Quantive (formerly Gtmhub) is the world’s leading Strategy Execution Platform based on the OKR management methodology.,"Dec 16, 2021",Series C,"$120,000,000","Techstars, Insight Partners, Eleven Ventures,,",$10M to $50M,—,"Greater Denver Area, Western US"
Wellvana,—,11-50,"Wellvana is a hospital and healthcare that specialized in providing the required infrastructure to enable the collaboration of independent medical providers to improve healthcare quality, cost, and patient experience. Its services also offer a platform for providers to actively shape their future and provide patients with the right care, in the right care setting. The company was founded in 2018 and is headquartered in San Antonio, Texas.","Nashville, Tennessee, United States",2019,"Health Care, IT Infrastructure,",Wellvana provides the required infrastructure to enable the collaboration of independent medical providers.,"Mar 10, 2023",Series B,"$84,000,000","Memorial Hermann Foundation,,,",—,—,Southern US
Amarenco,—,101-250,"Amarenco is a fast growing, independent Solar PV investment company with a founding executive team that has wide and deep experience in energy and renewables infrastructure.","Cork, Cork, Ireland","Jan 1, 2013","Energy, Renewable Energy, Solar","Amarenco is a fast growing, independent Solar PV investment company with a founding executive team that has wide and deep experience in","Mar 14, 2023",Private Equity,"€300,000,000","Tikehau Capital, IDIA Capital Investissement,",—,—,European Union (EU)
Graphiant,—,101-250,"Graphiant is a venture-funded startup working on next-generation networking technologies. The company has developed Graphiant Network Edge, a software-as-a-service solution that connects the enterprise WAN, hybrid cloud, network edge, clients, and partners. It was founded in 2020 and is headquartered in San Jose, California.","San Jose, California, United States","Aug 10, 2020","Impact Investing, Information Technology,",Graphiant is a venture-funded startup working on next-generation networking technologies.,"Mar 28, 2023",Series B,"$62,000,000","Sequoia Capital, Atlantic Bridge,,",—,—,"San Francisco Bay Area, Silicon Valley,"
JhaJi Store,—,11-50,"JhaJi Store is an online store offering homemade pickled products using authentic traditional recipes. Kalpana and Uma Jha started this business to take Mithila’s authentic taste to people who have once lived in the region but have since moved out for work or education. Over the last 30 years, both of them have been shipping pickles to friends and family everywhere from New Delhi to New York. In a little over 18 months, the business has profitably sold pickles worth more than Rs. 5 Crores to 60,000+ customers all over the country and has received 2500+ 5-star reviews. The pickles are made using local, all-natural ingredients and spices sourced from small-scale farmers and traders in Samastipur and Muzaffarpur. JhaJi’s pickles are completely free of all artificial or chemical preservatives and colors. JhaJi Store is an honest and conscious business that employs mostly underprivileged women, but also men, who have seen their family income triple in the few months they have been working with JhaJi. The business also spends 2% of its revenues directly towards the cause of girl child education.","Darbhanga, Bihar, India","Oct 22, 2020","Commercial, Consumer Goods,,","JhaJi Store is an online store offering homemade pickled products using authentic traditional recipes from Mithilanchal, Bihar","Jan 2, 2023",Angel,"₹130,000,000","Namita Thapar, Vineeta Singh,,,",—,—,Asia-Pacific (APAC)
Ather Energy,—,1001-5000,Ather Energy is a manufacturer of electric scooters and an electric vehicle charging network called AtherGrid. It focuses on building a complete ecosystem for India’s electric vehicles which are powered by indigenous design and all locally manufactured.,"Bangalore, Karnataka, India",2013,"Clean Energy, Electric Vehicle,,",Ather Energy operates as a manufacturer of electric scooters.,"Oct 18, 2022",Series E,"₹4,006,400,000","Tiger Global Management, InnoVen Capital,,,",—,—,Asia-Pacific (APAC)
E8,—,51-100,"E8 provides internet services for individuals and other companies access to the internet. They offer home and commercial internet packages. They promote poverty reduction, learning, remote work, communication, entertainment, and access to services for daily life in the digital environment.","Dallas, Texas, United States",2015,"Commercial, Internet, Telecommunications",E8 is an internet company that provides telecommunications services.,"Mar 15, 2023",Venture - Series Unknown,"$200,000,000",Digital Alpha,—,—,"Dallas/Fort Worth Metroplex, Southern US"
DICE,—,101-250,"DICE was founded in London in 2014, DICE helps fans discover and buy tickets to live shows and streams all over the world. Available in the UK, US, France, Italy, Spain, India and Australia, and accessible to fans globally through its live stream offering, DICE is on a mission to get people out more.","London, England, United Kingdom",2014,"Events, Media and Entertainment,,",DICE is a curated platform that connects fans to live shows.,"Sep 27, 2021",Series C,"$122,000,000","Kima Ventures, Edward Lando,,,",$1M to $10M,—,—
qlub,—,101-250,"Qlub develops a fast and secure payment solution for consumers in restaurants. Qlub allows restaurant, pub, and cafe owners to present their menus and accept payments in seconds. It's the kind of fast-paced stuff that people are used to, with the added benefit of keeping staff and guests happy. Qlub only takes 10 seconds to pay by scanning a QR code, paying with one click, and walking away. All of this is possible without the need to install an app.","Dubai, Dubai, United Arab Emirates",Jul 2021,"Financial Services, FinTech, Payments,",Qlub develops a fast and secure payment solution for consumers in restaurants.,"Mar 17, 2023",Series A,"$25,000,000","Al Dhabi Capital, Cherry Ventures,,,",—,—,Gulf Cooperation Council (GCC)
Acceldata,Yes,101-250,"Founded in 2018, Campbell, CA-based Acceldata has developed the world's first enterprise data observability platform to help enterprises build and operate great data products. Acceldata's solutions have been embraced by global customers, such as Dun & Bradstreet, Verisk, Oracle, PubMatic, PhonePe (Walmart), DBS, and many more. Acceldata investors include Insight Partners, March Capital, Industry Ventures, Lightspeed, Sorenson Ventures, Sanabil, and Emergent Ventures. Contact us to learn about the benefits of data observability. The company was founded in 2018 and is based in San Jose, California.","Campbell, California, United States",2018,"Big Data, Enterprise Software,",Acceldata offers a comprehensive data observability platform which allows data-driven enterprises to streamline their operations.,"Feb 8, 2023",Series C,"$50,000,000","Insight Partners, Sanabil, Industry Ventures,,",—,—,"San Francisco Bay Area, Silicon Valley,"
Travelport,—,1001-5000,"Travelport is a technology company that makes the experience of buying and managing travel continually better. It operates a travel commerce platform providing distribution, technology, payment, and other solutions for the global travel and tourism industry.","Slough, Buckinghamshire, United Kingdom",1971,"Adventure Travel, E-Commerce,,,,,,","Travelport Limited provides business services, as well as transaction processing solutions and data to companies operating in the travel.","Jun 5, 2020",Private Equity,"$500,000,000","Canada Pension Plan Investment Board,,,",$1B to $10B,—,—
