Grubhub,—,1001-5000,"Grubhubis a online and mobile food-ordering and delivery marketplace with the largest and most comprehensive network of restaurant partners, as well as nearly 24 million active diners. Dedicated to connecting diners with the food they love from their favourite local restaurants, Grubhub elevates food ordering through innovative restaurant technology, easy-to-use platforms and an improved delivery experience. Grubhub features nearly 300,000 restaurants and is proud to partner with more than 200,000 of these restaurants in over 4,000 U.S. cities. The Grubhub portfolio of brands includes Grubhub, Seamless, LevelUp, AllMenus and MenuPages.","San Francisco, California, United States",2004,"E-Commerce, Food and Beverage,,",Grubhub is a online and mobile food ordering and delivery marketplace dedicated to connecting diners with local restaurants.,"Jul 6, 2022",Post-IPO Equity,—,"Amazon, T. Rowe Price, Lightspeed Venture Partners,,",$100M to $500M,—,"San Francisco Bay Area, West Coast,"
Confluera,Yes,11-50,"Confluera is a cybersecurity startup helping organizations find sophisticated security attacks going on inside of corporate infrastructures. The startup delivers autonomous infrastructure-wide cyber kill chain tracking and response by leveraging the ‘Continuous Attack Graph’ to deterministically stop and remediate cyber threats in real-time. They built to deterministically detect and stop attackers from navigating infrastructure. Confluera technology combines machine comprehended threat detection with accurately tracked activity trails to stop cyberattacks in real-time, allowing companies to radically simplify security operations. It frees up human security personnel to focus on more important work, instead of spending hours trying to join the dots between the thousands of alerts they receive daily many of which are false positives.","Palo Alto, California, United States","Jun 18, 2018","Cyber Security, Information Technology,,,",Confluera provides security platform featuring a broad range of autonomous capabilities that deterministically track ongoing cyber threats.,"May 19, 2020",Series A,"$20,000,000","Lightspeed Venture Partners, Icon Ventures,,,",$1M to $10M,—,"San Francisco Bay Area, Silicon Valley,"
Celestia,—,1-10,"Celestia is a pluggable consensus and data availability layer, to enable anyone to quickly deploy a decentralized blockchain without the overhead of bootstrapping a new consensus network. The company was founded in 2019 and is based in Vaduz, Liechtenstein.","Vaduz, Vaduz, Liechtenstein",2019,"Blockchain, Cryptocurrency, Legal Tech,",Celestia is a blockchain ledger company that enables anyone to easily deploy their own blockchain with minimal overhead.,"Oct 19, 2022",Series A,"$55,000,000","Protocol Labs, Figment, Polychain,,",Less than $1M,—,—
Live Nation Entertainment,—,10001+,"Live Nation Entertainment Inc, the world’s live entertainment company, combines several entertainment brands, including Ticketmaster.com, Live Nation Concerts, the Live Nation and Live Nation Productions. Live Nation began as SFX Entertainment, a part of SFX Broadcasting, and then became a division of Clear Channel Communications. It became its own entity in 2005 with Michael Rapino as President and CEO. Since then, Live Nation has provided live entertainment services to fans in over 40 countries around the world through promotion and hundreds of entertainment venues. Live Nation partnered with Ticketmaster, the global leader in live event ticketing, in 2010 to form Live Nation Entertainment. This relationship has allowed both companies to expand their reach to help more fans experience the power of live each year. Live Nation Concerts produces over 35,000 live music events annually in conjunction with Live Nation Entertainment’s 4,000+ touring artists. Live Nation fully acquired Front Line Management Group in 2011, giving the company access to the artists it represents, now numbering over 500, including top acts such as Chicago, Alan Jackson and Jimmy Buffett. Each of these businesses supports the Live Nation Network, the leading provider of entertainment marketing solutions. Live Nation Network connects more than 1000 advertisers to its network of consumers through Live Nation live event and digital platforms. Live Nation Entertainment has recently focused investments on profitable music festivals and initiatives associated with them. Some of the festivals Live Nation Entertainment has a controlling stake in include Lollapalooza and Bonnaroo. They also have a partnership with Insomniac who runs the Electric Daisy Carnival. Part of these investments include upgrading facilities at the festivals, including adding permanent bathrooms and running water. Live Nation Entertainment has an international presence, which has allowed them to acquire businesses around the world including the House of Blues (2006), a United States concert promoter; Union Events in Canada (2016) and Mainland Music (2018), based in Switzerland. It has also gained majority interest in AC Entertainment (2016), the Sweden Rock Festival (2016), Australia’s Secret Sounds Group (2016) and DF Entertainment (2018).","Beverly Hills, California, United States",1996,"Concerts, Event Promotion, Events,,","Live Nation Entertainment is a producer, promoter, and seller of live concert tickets for artists and fans.","Jan 9, 2023",Post-IPO Debt,"$900,000,000",Saudi Arabia's Public Investment Fund,$1B to $10B,—,"Greater Los Angeles Area, West Coast,"
Etsy,Yes,1001-5000,"is an e-commerce site and a smartphone application for buying and selling handmade and vintage items. Users can find products in the categories of clothing and accessories, jewelry, craft supplies and tools, weddings, entertainment, home and living, kids and babies, vintage, and more. was launched by Robert Kalin, Haim Schoppik, Jared Tarbell, and Chris Maguire in June 2005 and is based in Brooklyn, New York.","Brooklyn, New York, United States","Jun 18, 2005","E-Commerce, Internet, Retail, Sales",Etsy is an e-commerce site and a smartphone application for buying and selling handmade and vintage items.,"May 15, 2017",Post-IPO Equity,—,"TPG, Accel, Breyer Capital, Union Square Ventures,",$100M to $500M,—,"Greater New York Area, East Coast,"
Span.IO,—,51-100,"Span.IO develops products to enable the rapid adoption of renewable energy and deliver an intuitive interface for the home. They are a group of engineers with a passion for building products that can deliver a positive impact on the environment while enhancing the consumer experience. They believe that developing intelligent hardware and software that provides visibility and control at the edge-of-grid will be transformational to the energy sector. The company is backed by domain experts in energy, software, hardware, and consumer finance. They leverage their teams' collective experience in power generation, energy conversion, controls, and system integration to develop core products focused on enabling the rapid adoption of renewable energy. SpanIO is based in San Francisco in 2018.","San Francisco, California, United States","Jun 12, 2018","Energy, Hardware, Internet of Things,,",Span.IO develops residential energy storage devices that provide renewable electricity and charging services for electric vehicles.,"Mar 3, 2023",Venture - Series Unknown,"$83,952,933","Ulu Ventures, Elemental Excelerator,,,",$1M to $10M,"South Asian Founded, South Asian Led","San Francisco Bay Area, West Coast,"
SEMrush,Yes,501-1000,"SEMrush is online visibility management and content marketing SaaS platform that ensures businesses get measurable results from online marketing. Trusted by more than 5,000,000 marketing professionals, SEMrush offers insights and solutions for companies in any industry to build, manage, and measure campaigns across all marketing channels. With 40+ tools for search, content, social media and market research in the platform, data for more than 140 countries, seamless integration with Google and task management platforms, SEMrush is now a must-have solution for all companies who are serious about online.","Boston, Massachusetts, United States",Aug 2008,"Advertising, Analytics, Content Marketing,,,,,,,",SEMrush is a an online visibility management and content marketing SaaS platform.,"Apr 24, 2018",Venture - Series Unknown,"$40,000,000","Headline, Greycroft, Siguler Guff & Company",$100M to $500M,—,"Greater Boston Area, East Coast,"
GoDaddy,—,5001-10000,"Go Daddy is the Web's top platform for small businesses and offers everything needed to to grow and manage an online presence, from domain names and website builders to complete eCommerce solutions. The company has earned a place as the world's #1 ICANN-accredited domain registrar by delivering world-class products at competitive prices and supporting them with industry-best service, delivered 24/7/365. Go Daddy is the world's largest domain name registrar and Web hosting provider * More than 55 million domain names under management Go Daddy registers, renews or transfers more than one domain name every second of every day Go Daddy is larger than the next 8 closest registrar competitors combined Go Daddy is the largest hosting provider of secure websites in the world More than 12 million customers Go Daddy is the world's largest provider of net-new SSL certificates Go Daddy has more than 40 product offerings Founded in 1997 by Bob Parsons as Jomax Technologies the Go Daddy group of companies includes three ICANN-accredited domain name registrars: flagship registrar GoDaddy.com, LLC, membership-based Blue Razor Domains, LLC, and reseller Wild West Domains, LLC Private domain name registration services through Domains By Proxy, LLC","Scottsdale, Arizona, United States",1997,"Domain Registrar, Online Portals,,",GoDaddy is an internet domain registrar and web hosting company facilitating online businesses.,"Dec 27, 2021",Post-IPO Equity,"$800,000,000","Silver Lake, Starboard Value, Kohlberg Kravis Roberts,",$1B to $10B,—,"Greater Phoenix Area, Western US"
PrizePicks,—,101-250,"PrizePicks is the largest independently owned Daily Fantasy Sports (DFS) platform in North America. Centered around real-money over/under predictions, PrizePicks allows sports fans to play against the numbers rather than each other, and it is the simplest variety of daily fantasy sports with the widest breadth of sports coverage of any DFS operator. Boasting partnerships to date with the Atlanta Braves and Miami Marlins, among others, PrizePicks is currently the closest legal alternative to legal mobile sports betting in the majority of the United States including Top 10 markets like California, Texas, Florida, and Georgia. With an existing digital footprint covering more than 60 percent of the U.S. population, PrizePicks is the most accessible type of game for the masses. The company is headquartered in Atlanta, and PrizePicks is the third product from Performance Predictions, a suite of fan engagement solutions including SidePrize, the 2016 Fantasy Sports and Gaming Association's ""Rookie of the Year"" award recipient. PrizePicks is available in the App Store and Google Play or at prizepicks.com.","Atlanta, Georgia, United States",2015,"Fantasy Sports, Gaming, Sports",PrizePicks is a Daily Fantasy Sports (DFS) platform that covers sports betting in a wide variety of leagues.,"Mar 23, 2023",Corporate Round,—,"Atlanta United, Phoenix Capital Ventures (PCV),,,",—,—,"Greater Atlanta Area, East Coast,"
Nationwide Building Society,—,10001+,"Nationwide Building Society is a British mutual financial institution and the largest building society in the UK. It has its headquarters in Swindon, with an office in Threadneedle Street, London, and with administration centres based in Bournemouth, Northampton and Dunfermline. Nationwide’s origins lie in the Provident Union Building Society (Wiltshire, 1846), the Northampton Town & County Freehold Land Society (Northampton 1848), and within the co-operative movement in London (1884). Following numerous mergers – most importantly the merger with Anglia Building Society in 1987 and the Portman Building Society in 2007, Nationwide is the now the world’s largest mutual financial institution, the UK’s third largest mortgage lender, and one of the UK’s largest savings providers.","Swindon, Wiltshire, United Kingdom",1846,"Finance, Financial Services, Insurance",Nationwide Building Society is a British mutual financial institution and the largest building society in the UK.,"May 14, 2019",Grant,"£50,000,000",Capability and Innovation Fund,$50M to $100M,—,—
QuickNode,—,251-500,"QuickNode is a Web3 infrastructure platform, helping developers and businesses build, launch, and scale blockchain-powered applications (dApps). The company's global API provides instant access to over 16 networks including Ethereum, Solana, Polygon, BSC and Avalanche. QuickNode's tools, enhanced APIs, and 1-click integrations save time, helping builders create the best version of their app and get to-market faster. Trusted by Fortune 500 companies and serving 100s of Billions requests per month, QuickNode is helping the blockchain ecosystem grow since 2017.","Miami, Florida, United States",2017,"Blockchain, Developer Tools, Ethereum,",QuickNode is a Blockchain Development Platform that helps build and scale web3 applications faster.,"Jan 24, 2023",Series B,"$60,000,000","Protocol Labs, SoftBank, Tribe Capital,,",—,"Black / African American Led,","Greater Miami Area, East Coast,"
Snowflake,—,1001-5000,"Snowflake is a cloud data platform that provides a data warehouse-as-a-service designed for the cloud. The platform is built for the cloud, focusing on an instant, secure, governed access to an entire network of data, and is built to enable a variety of data workloads, including a single platform for developing modern data applications. It combines the power of data warehousing, the flexibility of big data platforms, and the elasticity of the cloud at a fraction of the cost of traditional solutions. The company was co-founded by Thierry Cruanes, Marcin Zukowski, Bob Muglia, and Benoit Dageville in 2012 and is headquartered in San Mateo, California.","San Mateo, California, United States","Jan 1, 2012","Analytics, Cloud Data Services,,",Snowflake is a cloud data platform that provides a data warehouse-as-a-service designed for the cloud.,"Apr 19, 2022",Post-IPO Equity,"$621,456,438","Sequoia Capital, Madrona, Wing Venture Capital,,",$1B to $10B,—,"San Francisco Bay Area, Silicon Valley,"
Cowboy,—,101-250,"Cowboy is an e-bike company that creates innovative electric bikes for city riders. It is still transforming the bike and mobility industries, from the point of sale to the point of service. Its mission is to empower riders to map their own paths, as well as the paths of the cities in which they live, through mindful movement that benefits everyone. Cowboy's electric bikes are simple — there is no gear and no + and - buttons to adjust the motor's power. The company believes riding a bike should be as simple as hopping into the saddle and putting one foot on the peddle.","Brussels, Brussels Hoofdstedelijk Gewest,",2017,"Electric Vehicle, Mobile, Transportation",Cowboy is an ebike company that creates innovative electric bikes for city riders.,"Mar 8, 2023",Venture - Series Unknown,"€15,000,000","Crowdcube, Tiger Global Management,,,",—,—,European Union (EU)
Mystifly,—,251-500,"Mystifly is an anywhere-to-anywhere B2B global airfare marketplace with fares from 900+ airlines, multi-GDS and also 170+ LCCs, across 70+ points of sale countries across the Americas, EMEA and APAC. The company focuses on applying the right mix of technology and inventive thought process to disrupt the air travel industry.","Singapore, Central Region, Singapore","Jul 30, 2009","Leisure, Tourism, Travel","Mystifly is a B2B application programming interface that provides ticketing, airline retailing, and post-ticketing services to end-consumers","Mar 23, 2023",Series B,"$4,700,000","Crusade Partners, Jenfi, Recruit Holdings,,",—,—,"Asia-Pacific (APAC), Association of Southeast Asian Nations (ASEAN),"
SpotDraft,—,101-250,"SpotDraft is an AI-driven contract management and automation solution designed for fast-growing companies. It offers end-to-end contract management services for legal, sales, marketing, human resources, business operations, and procurement teams. With its best-in-class platform, SpotDraft acts as a co-pilot for legal teams, helping them optimize the contract management process by eliminating inefficiencies and reducing repetitive tasks. Streamline your contracting process with an intuitive interface, intelligent contract repository, customizable templates and workflows, and much more. SpotDraft integrates with popular SaaS tools, such as Salesforce, HubSpot, Slack, and Google Drive, delivering a seamless experience for global businesses, including Airbnb, Notion, STRAVA, Beamery, and Fidelity International. Founded in 2017 by a Harvard law graduate and two Carnegie Mellon computer engineers, SpotDraft raised $26 million in Series A funding in 2023 to further enhance its platform, expand its team, and accelerate growth.","Bangalore, Karnataka, India",2017,"Computer, Internet, Legal, Legal Tech,,","SpotDraft makes end-to-end contract lifecycles smoother, faster, and easier so lawyers get more time to focus on work that really matters.","Mar 2, 2023",Series A,"$26,000,000","500 Global, Prosus Ventures, PremjiInvest,,",—,—,Asia-Pacific (APAC)
SmartBear,Yes,251-500,"SmartBear is a developer of enterprise-class software development and testing tools.The company's software uses code review, application programming interface (API) and UI level testing and monitoring across mobile, web and desktop applications, enabling enterprises to automate mundane tasks, easily track and report the success of testing efforts.","Somerville, Massachusetts, United States",2009,"Cloud Computing, Developer APIs,,,",SmartBear is a developer of enterprise-class software development and testing tools.,"Oct 21, 2020",Private Equity,"$2,868,750","Francisco Partners, Insight Partners,",$100M to $500M,—,"Greater Boston Area, East Coast,"
Oak Street Health,—,101-250,"Oak Street Health is a primary care center for adults on Medicare in medically-underserved communities where there is little to no quality healthcare. Its care is based on an entirely new model that is based on value for its patients, not on the volume of services. IT was founded in 2012 and headquartered in Chicago, Illinois.","Chicago, Illinois, United States",2012,"Health Care, Health Diagnostics,,",Oak Street Health is a network of primary care centers for adults on Medicare.,"Nov 16, 2022",Post-IPO Debt,"$300,000,000","Silicon Valley Bank, Hercules Capital,,,",$100M to $500M,—,"Greater Chicago Area, Great Lakes,"
Glassdoor,—,501-1000,"Glassdoor is a job and recruiting sites that operates online jobs and career community. It helps employees, job seekers, employers, and recruiters in finding and sharing information about the companies and jobs that include company reviews, interview questions and reviews, office photos, salary details, and information to make career decisions. Rich Barton, Robert Hohman, and Tim Besse founded June 2007, with its headquarters in Mill Valley in California. Glassdoor operates worldwide.","Mill Valley, California, United States",Jun 2007,"Career Planning, Digital Media,,,",Glassdoor is a job and recruiting sites that operates online jobs and career community.,"Jan 26, 2017",Secondary Market,—,"T. Rowe Price, EquityZen, Tiger Global Management,,",$100M to $500M,—,"San Francisco Bay Area, West Coast,"
Chroma Medicine,—,51-100,"Chroma Medicine is a new genomic medicine company working on epigenetic editing. Chroma Medicine is pioneering a new class of genomic medicines that harness epigenetics, nature’s innate mechanism for gene regulation, to revolutionize the treatment of genetically driven diseases. Chroma Medicine was established in 2021 in Cambridge, Massachusetts.","Cambridge, Massachusetts, United States",2021,"Biotechnology, Medical, Therapeutics",Chroma Medicine is a new genomic medicine company working on epigenetic editing.,"Mar 1, 2023",Series B,"$135,000,000","ARCH Venture Partners, T. Rowe Price,,,",—,Women Led,"Greater Boston Area, East Coast,"
OpenLoop,—,11-50,"OpenLoop is an online hiring platform that matches physicians and other healthcare providers with hiring institutions within their region. The platform innovations of the company simplify telehealth by gathering all current employment demands, centralizing the provider database, and contacting healthcare institutions based on their region and specialty when opportunities exist, allowing hospitals and other recruiters to fill staff shortages. OpenLoop was established on January 1, 2020 in Des Moines, Iowa.","Des Moines, Iowa, United States","Jan 1, 2020","Health Care, Medical, Service Industry,",OpenLoop is an online hiring platform that matches physicians and other healthcare providers with hiring institutions within their region.,"Mar 16, 2023",Series A,"$15,000,000","Techstars, Panoramic Ventures,,,",$1M to $10M,—,Midwestern US
R-Zero,—,101-250,"R-Zero is the first biosafety technology company dedicated to making the indoor spaces we share safer, healthier, and more productive. Dedicated to developing the most effective and innovative disinfection technologies, R-Zero is setting a new standard for health in the built environment. Today, the company is pioneering the first continuous, automated disinfection ecosystem, enabling every organization to measure and manage indoor health risks with a new level of sophistication and ease. Combining space utilization sensor technology, AI, ML, and IoT-connected hardware, R-Zero’s intelligent biosafety technology platform provides greater visibility, automation, and even smarter risk reduction within the indoor spaces where humans spend 90% of their time.","Salt Lake City, Utah, United States",Apr 2020,"Biotechnology, Hardware, Internet of Things,,,","R-Zero is a biosafety technology company dedicated to making shared indoor environments safer, healthier, and more productive.","Feb 14, 2023",Series C,"$105,000,000","Mayo Clinic, Upfront Ventures,,,",$1M to $10M,—,Western US
Hercules Capital,Yes,51-100,"Hercules is the largest non-bank lender to venture capital-backed companies at all stages of development in a broadly diversified variety of technology, life sciences, and sustainable and renewable technology industries. With over a decade of experience in venture debt, Hercules is uniquely positioned to quickly create innovative financing solutions that perfectly fit within a company's existing capital structure and map to its business objectives. Recognized as the industry leader, Hercules understands the flexibility these types of companies need and has the experience to work closely with them, even through challenging times, to help them reach critical milestones. Hercules' deep sector expertise, geographic presence and its strong capital base have made Hercules the lender of choice for more than 480 innovative companies.","Palo Alto, California, United States","Dec 30, 2003","Commercial Lending, Financial Services,,","Hercules Capital is a capital market company that lends to technology, life sciences, and sustainable technology companies.","May 17, 2016",Post-IPO Debt,"$6,500,000",AloStar,$50M to $100M,—,"San Francisco Bay Area, Silicon Valley,"
