Organization Name,Actively Hiring,Number of Employees,Full Description,Headquarters Location,Founded Date,Industries,Description,Last Funding Date,Last Funding Type,Last Funding Amount,Top 5 Investors,Estimated Revenue Range,Diversity Spotlight (US Headquarters Only),Headquarters Regions
Monroe Capital,—,101-250,"Monroe Capital is a specialty finance company providing senior secured and junior secured debt to middle-market companies. Monroe Capital specializes in originating, structuring and providing customized one-stop financings to U.S. and Canadian borrowers. Monroe is committed to being a value-added and user-friendly partner to owners, senior management and transaction sponsors. Investment types include senior and junior secured debt as well as bridge loans, flexible acquisition facilities, mezzanine or last-out secured loans that stretch a companyâ€:tm:s debt capacity, acquisitions of distressed debt and equity co-investments. Monroe Capital prides itself on its flexible investment approach and its ability to close and fund transactions quickly.","Chicago, Illinois, United States","Oct 12, 2004","Banking, Business Development,,",Monroe Capital is a provider of senior and junior debt and equity co-investments to middle market companies in the U.S. and Canada,"Oct 1, 2015",Debt Financing,"$11,000,000",—,$50M to $100M,—,"Greater Chicago Area, Great Lakes,"
Droit,—,101-250,"Droit develops mission-critical solutions to improve global regulatory compliance and real-time controls. Droit Adept is an innovative, patented platform that drives intelligent decision-making in an increasingly complex, rule-driven environment. Adept is trusted by financial institutions to provide solutions for pre-trade and post-trade controls, evaluating transaction permissibility, compliant regulatory reporting, and more. Droit was founded by a team of veteran derivative traders, quants, e-commerce specialists, and technologists with front-line experience and expertise with products, markets, regulations, and systems.","New York, New York, United States",2012,"Compliance, Finance, Information Technology,",Droit is a technology firm that offers a platform focused on computational law and regulation within finance and other domains.,"Mar 7, 2023",Series B,"$23,000,000","UBS, Goldman Sachs, Wells Fargo,,",$1M to $10M,—,"Greater New York Area, East Coast,"
F88,—,251-500,"F88 is a financial services firm that provides loans for micro and small businesses and individual consumers. The company offers small loans, typically secured by automobiles, and offers financial services including insurance and money transfers. F88’s competitive advantage lies in the professional management team with a strong commitment to bringing customers reliable, professional, friendly, and fast financial services, from which, to change social perceptions about the traditional pawn market. With a wide network of stores, a modern technology system, well-trained staff and high-quality services, F88 has been honored Gold Cup for reliable products, perfect service, and preferred brands in 2016 granted by Intellectual Property and Creativity magazine – Intellectual Property Association of Viet Nam and Intellectual Property International Academy.","Hanoi, NA - Vietnam, Vietnam","Jul 15, 2013","Consumer, Finance, Financial Services,",F88 is a financial services firm that provides loans for micro and small businesses and individual consumers.,"Mar 1, 2023",Venture - Series Unknown,"$47,000,000","Lendable, Mekong Capital, CLSA Capital Partners,,",$1M to $10M,—,"Asia-Pacific (APAC), Association of Southeast Asian Nations (ASEAN),"
Mayo Clinic,—,10001+,"Mayo Clinic, a not-for-profit medical group practice, provides medical care, research, and education services. It offers medical care services in various specialties, including diabetes and endocrinology, gastroenterology, gynecology, cancer, neurology and neurosurgery, orthopedics, pulmonology, rheumatology, nephrology, urology, and cardiology and heart surgery.","Rochester, Minnesota, United States",1919,"Biotechnology, Health Care, Hospital,,,","MayoClinic is a nonprofit medical practice and medical research group focused on integrated health care, education, and research.","Oct 31, 2019",Grant,"$15,000,000","National Institutes of Health, U.S. Department of Defense,",$10B+,—,"Great Lakes, Midwestern US"
FIS,—,10001+,"FIS focuses on retail and institutional banking, payments, asset and wealth management, risk and compliance, and outsourcing solutions. FIS serves more than 20,000 clients in over 130 countries. Headquartered in Jacksonville, Florida, FIS employs more than 53,000 people worldwide. FIS is a Fortune 500 company and is a member of the Standard & Poor’s 500® Index.","Jacksonville, Florida, United States",1968,"Banking, Financial Services, Information Technology,","FIS focuses on retail and institutional banking, payments, asset and wealth management, risk and compliance, and outsourcing solutions.","Jul 6, 2022",Post-IPO Debt,"$2,500,000,000","Alumni Ventures, OceanIQ Capital,,",$1B to $10B,—,"East Coast, Southern US"
Envisics,—,51-100,"ENVISICS branded technology harnesses the power of holography and laser-based light sources to provide the highest possible image quality. The advancement of ENVISICS branded technology has the opportunity to transform automotive displays and revolutionize the in-car experience. In partnership with the world's leading automakers and tier-one suppliers, Envisics is making the future of holographic technology a reality for smarter and safer vehicles","Milton Keynes, Milton Keynes,","Jan 1, 2018","Augmented Reality, Automotive,,,",Envisics is a holographic technologies company focused on augmented reality head-up displays (AR-HUDs) and automotive sensor systems.,"Mar 9, 2023",Series C,"$50,000,000","Hyundai Mobis, InMotion Ventures,,,",$1M to $10M,—,—
Doctolib,—,1001-5000,"Doctolib is an online healthcare booking platform and management software provider. For doctors, Doctolib offers a full-range service to improve bookings management, reduce no-show, and bring new patients to their office. For patients, Doctolib is a free online service to find a nearby health practitioner and book doctors or dental appointments 24/7 within a few clicks. Founded in 2013, Doctolib is based in Paris, France.","Paris, Ile-de-France, France",2013,"Health Care, Medical, Mobile Apps,",Doctolib is an online and mobile booking platform that helps users find doctors and make appointments.,"Mar 15, 2022",Series F,"€500,000,000","Eurazeo, Bpifrance, Accel, General Atlantic,",—,—,European Union (EU)
Recorded Future,Yes,1001-5000,"Recorded Future develops a single intelligence platform for enterprise security. The platform delivers an end-to-end view of threats across the enterprise. It is purpose-built for user and technology workflows, with the broadest set of integrations, including every SIEM and SOAR provider. Data is dynamically linked and updated as changes occur, with direct source evidence to justify decision-making.","Somerville, Massachusetts, United States",2009,"Analytics, Cyber Security, Intelligent Systems,",Recorded Future develops a single intelligence platform for enterprise security.,"Mar 17, 2023",Venture - Series Unknown,"$11,325,964","Google Ventures, Insight Partners,,,",$1M to $10M,—,"Greater Boston Area, East Coast,"
Xiaohongshu,—,1001-5000,"Xiaohongshu is a lifestyle-sharing platform for users to share positive energy and good life through the sharing of text, pictures, and videos. Xiaohongshu offers an overseas shopping tip app. Xiaohongshu started its business by helping overseas travelers to draft a shopping list before they hit the roads. But with the aggregation of more UGC content, the service is transforming into a community for those who are passionate about fashion and shopping and want to know more about these fields even though they do not have overseas traveling plans on their schedules.","Shanghai, Shanghai, China",2013,"E-Commerce, Mobile Apps, Shopping,",Xiaohongshu is a social e-commerce platform for users to share product reviews and shopping experiences.,"Nov 8, 2021",Series E,"$500,000,000","Tencent, Alibaba Group, GSR Ventures,,",$500M to $1B,—,Asia-Pacific (APAC)
CyberConnect,—,11-50,CyberConnect is a decentralized social graph protocol with identity sovereignty for mass adoption and network effects.,"Palo Alto, California, United States",2021,Information Technology,CyberConnect is a decentralized social graph protocol with identity sovereignty for mass adoption and network effects.,"May 17, 2022",Series A,"$15,000,000","Protocol Labs, Animoca Brands,,,",—,—,"San Francisco Bay Area, Silicon Valley,"
Aclima,—,101-250,"Aclima is pioneering an entirely new way to diagnose the health of our air and track climate-changing pollution. Powered by our network of roving and stationary sensors, Aclima measures air pollution and greenhouse gases at unprecedented scales and block-by-block resolution. Our professional analytics software, Aclima Pro, translates billions of scientific measurements into environmental intelligence for governments, companies, and communities. Aclima is a purpose-driven technology company catalyzing bold climate action that protects public health, reduces emissions, and delivers clean air for all. We're backed by top-tier investors, including Social Capital, Kapor Capital and Microsoft Climate Innovation Fund. For more information please visit https://aclima.io.","San Francisco, California, United States",2007,"Analytics, CleanTech, Enterprise Software,,,,,,,","Measuring air, everywhere. We are pioneering an entirely new way to diagnose the health of our air and track climate-changing pollution.","Nov 19, 2020",Series B,"$40,000,000","Kapor Capital, Splunk, Social Capital,,",$1M to $10M,"Women Founded, Women Led","San Francisco Bay Area, West Coast,"
Clyde,—,51-100,Clyde is a product lifecycle platform that aims to assist businesses to increase profits and provide their clients with high-quality services.,"New York, New York, United States",Sep 2017,"E-Commerce, Finance, Insurance,,",Clyde is a product lifecycle platform that aims to assist businesses to increase profits.,"Oct 19, 2021",Series B,"$25,000,000","Techstars, Spark Capital, Correlation Ventures,,",—,—,"Greater New York Area, East Coast,"
Dialpad,Yes,501-1000,"Dialpad is an AI-powered cloud communications platform that turns conversations into opportunities and helps teams make smart calls. The communications and contact center provider offers native, real-time transcription, automated note-taking, live sentiment, and voice analytics to market, and with the rising demand for remote collaboration. It offers Dialpad, Dialpad Sell, UberConference, and Dialpad Contact Center solutions that are all powered by VoiceAI. These products cover the full range of modern business communications needs with a range of system software that offers voice, video, group messaging, SMS, MMS, conferencing, screen sharing, and document sharing services that enable employees to collaborate securely from anywhere across any device, in a single platform. Aside from OMERS, investors of the company include Amasia, Andreessen Horowitz, Felicis Ventures, GV, ICONIQ Capital, Salesforce Ventures, Scale Ventures, Section 32, Softbank, Work-Bench, and SoftBank. Alex Cornell, Brian Peterson, Craig Walker, and John Rector incorporated Dialpad in San Francisco, California in 2011.","San Francisco, California, United States",Apr 2011,"Analytics, Artificial Intelligence,,,,,,,,",Dialpad is an AI-powered cloud communications platform that turns conversations into opportunities and helps teams make smart calls.,"Dec 22, 2022",Venture - Series Unknown,"$50,000,000","SoftBank, Andreessen Horowitz,,,",—,—,"San Francisco Bay Area, West Coast,"
AbbVie,—,10001+,"AbbVie develops pharmaceuticals and medical devices. They provide products and services to therapeutic areas including immunology, oncology, neuroscience, eye care, virology, women's health, and gastroenterology.","North Chicago, Illinois, United States",2013,"Biotechnology, Health Care, Medical,","AbbVie is a pharmaceutical company that discovers, develops, and markets in biopharmaceuticals and molecule drugs.","Mar 8, 2023",Post-IPO Equity,"$249,999",—,$10B+,—,"Greater Chicago Area, Great Lakes,"
DJI,—,10001+,"DJI develops and manufactures innovative drone and camera technology for commercial and recreational use. Their platforms empower them to capture images that were once out of reach. Their flying and camera stabilization systems redefine camera placement and motion. Headquartered in Shenzhen, widely considered China’s Silicon Valley, DJI benefits from direct access to the suppliers, raw materials, and young, creative talent pool necessary for sustained success. Drawing on these resources, they have grown from a single small office in 2006 to a global workforce. Their offices can now be found in the United States, Germany, the Netherlands, Japan, South Korea, Beijing, Shanghai, and Hong Kong. As a privately owned and operated company, DJI focuses on their own vision, supporting creative, commercial, and nonprofit applications of their technology.","Shenzhen, Guangdong, China","Nov 6, 2006","Aerospace, Consumer Electronics,,,,",DJI develops and manufactures innovative drone and camera technology for commercial and recreational use.,"May 6, 2015",Private Equity,"$75,000,000","Accel, Sequoia Capital China, Lighthouse Capital Management",$10M to $50M,—,Asia-Pacific (APAC)
Neste,—,1001-5000,"Neste creates sustainable aviation fuel, renewable diesel, and renewable feedstock solutions for the polymers and chemicals industries. Its global range of products and services allows customers to lower their carbon footprint by combining high-quality renewable products and oil products with tailor-made service solutions. We are the world's largest producer of renewable diesel refined from waste and residues, and we are also bringing renewable solutions to the aviation and plastics industries. We want to be a reliable partner, whose expertise, R&D, and sustainable practices are widely respected. In 2015, Neste's net sales stood at EUR 11 billion, and we were on the Global 100 list of the 100 most sustainable companies in the world.","Espoo, Southern Finland, Finland","Jan 9, 1948","Industrial, Oil and Gas, Sustainability",Neste is a sustainable energy company focused on renewable diesel and aviation fuel.,"Mar 9, 2023",Post-IPO Debt,"€1,000,000,000",—,$1B to $10B,—,"European Union (EU), Nordic Countries,"
Blueground,Yes,501-1000,"Blueground is a proptech company that is reinventing the way people live by making apartments available where they want, when they want, and on the terms they want. They offer fully-furnished homes with on-the-ground support for business travel needs.","New York, New York, United States","Apr 1, 2013","Hospitality, Property Management,",Blueground provides furnished apartments.,"Nov 28, 2022",Venture - Series Unknown,—,"Silicon Valley Bank, VentureFriends,,,",$1M to $10M,—,"Greater New York Area, East Coast,"
Rakuten,—,5001-10000,"Rakuten is a tech company that offers electronic commerce solutions in Japan and internationally. The company operates in three segments such as internet services, finance services, and others. The internet services segment comprises businesses running various e-commerce sites, including Rakuten Ichiba, an internet shopping mall; travel booking sites; portal sites; and e-book businesses as well as businesses for advertising and sale of contents and similar on these sites. Its offerings include e-reading, online travel reservations, online auctions, online marketing, online golf course reservations, portal sites, search engines, integrated internet marketing, online recipe posting and browsing, student recruiting community, online purchase of discount coupons, online shopping, and video on demand services. It is involved in the online sale of books, CDs, and DVDs. The internet finance segment is engaged in providing services related to banking and securities, credit cards, life insurance, and electronic money. This segment provides credit card payment, internet banking, online brokerage, online comprehensive insurance, and face-to-face and online life insurance services as well as credit card transactions on smartphones and tablets. The other segments are involved in the provision of communications services such as next-generation LTE-compatible mobile data communication, telecommunications, internet connection and corporate mobile phone services, and management of a professional baseball team. The company was formerly known as MDM, Inc. and changed its name to Rakuten, Inc. in June 1999. Rakuten, Inc. was founded in 1997 and is headquartered in Tokyo, Japan.","Tokyo, Tokyo, Japan","Feb 7, 1997","E-Commerce, Electronics, FinTech,,","Rakuten is a provider of e-commerce, fintech, digital content, and communications products and services.","Jan 27, 2023",Post-IPO Debt,"¥250,000,000,000","Tencent, Walmart, Intel Capital,,",$1B to $10B,—,Asia-Pacific (APAC)
DeHaat,—,1001-5000,"DeHaat is a technology-led platform that offers end-to-end agriculture services to Indian farmers with an aim to improve the efficiencies of the agriculture value chain. DeHaat connects small farmers to their various needs – Seeds, fertilizers, equipment, crop advisory, and market linkage through a wide network of trained micro-entrepreneurs. Registered farmers get access to a wide range of agricultural inputs (Seed, Fertilizer, and Crop protection) directly from competitive sources. Subsequently, they get customized crop reminder calls in the local language as well as crop monitoring support from the same DeHaat micro-entrepreneur. Lastly, they sell the farm produce directly to institutional buyers. Farmers place their various demands related to Agri input, field visits or Agri output either through the toll-free number or mobile application and get last-mile services through assigned micro-entrepreneur.","Patna City, Bihar, India","Feb 6, 2012","Agriculture, AgTech, Farming,",DeHaat is an AgriTech startup that offers technology solutions to improve supply chain and production efficiency in farming.,"Oct 21, 2022",Series E,"$60,000,000","Temasek Holdings, FMO, AgFunder,,",—,—,Asia-Pacific (APAC)
IntegrityNext,—,1-10,"IntegrityNext enables companies to monitor 100% of their suppliers for sustainability and compliance in order to meet the regulatory requirements and reduce risk. The IntegrityNext platform automatically obtains the required supplier self-assessments and certificates while monitoring social media for malpractice and reputational risks. The company's cloud-based platform reduces compliance risk through automated self-assessments, social media monitoring, and risk alerts, as well as a pre-built supplier questionnaire, assessment framework, and real-time dashboard, allowing small and medium-sized businesses to convert compliance data requirements from international regulators into processes and systems. IntegrityNext was established on April 10, 2016 in Munich, Bayern by Martin Berr-Sorokin.","Munich, Bayern, Germany","Apr 10, 2016","Consulting, Information Services,","IntegrityNext enables companies to monitor the environmental, social, and corporate governance of suppliers to meet legal requirements.","Mar 23, 2023",Venture - Series Unknown,"€100,000,000",EQT Growth,—,—,European Union (EU)
Switch Therapeutics,—,11-50,"Switch Therapeutics is a biotech company that develops RNAi therapies based on technology. The company was founded in 2020 and is based in San Francisco, California, United States.","San Francisco, California, United States",2020,"Biotechnology, Medical, Therapeutics",Switch Therapeutics is a biotech company that develops RNAi therapies.,"Mar 14, 2023",Series A,"$52,000,000","Global Brain Corporation, Insight Partners,,,",—,—,"San Francisco Bay Area, West Coast,"
Arcadia,—,501-1000,"Arcadia is a climate crisis-fighting technology company founded in 2014 and born out of a simple idea—everyone deserves access to clean energy. Arcadia breaks the fossil fuel monopoly by creating unprecedented access to energy data and renewable energy sources through its technology platform, Arc, and its community solar program. Arc fuels the renewable energy revolution by democratizing access to energy data from 125 utilities nationwide, covering more than 80% of US electric utility accounts. Arcadia also manages the nation’s leading community solar program, helping to tackle energy injustice while spurring economic growth with more than five Terawatt-hours of residential and commercial energy demand.","Washington, District of Columbia,",2014,"Clean Energy, CleanTech, Database,,",Arcadia is a climate software and data company that specializes in decarbonizing the electric grid.,"Dec 16, 2022",Venture - Series Unknown,"$125,000,000","Alumni Ventures, Tiger Global Management,,,",$10M to $50M,—,"Washington DC Metro Area, Southern US"
SEON,—,101-250,"SEON is a fraud prevention startup developing a fraud detection software to detect fraud in real-time through transactional data analysis. Its software uses machine learning and human intelligence algorithms to collect information about transactions and customers associated, integrates with a device fingerprinting module, and combines email verification and IP address analysis features to detect and report transactional and behavioral fraud patterns. It also allows businesses to detect and eliminate fraudulent activities and maintain data security. Founded in 2017, the company is based in Budapest, Hungary with commercial headquarters in London, UK.","Budapest, Budapest, Hungary",Jun 2017,"Fraud Detection, Identity Management,,",SEON is an online fraud prevention platform that detects and stops fraud in real-time through transactional data analysis.,"Apr 19, 2022",Series B,"$94,000,000","Creandum, IVP, PortfoLion Capital Partners,,",$1M to $10M,—,European Union (EU)
Copper,—,101-250,"Copper is the only crm made for G Suite, works instantly and has an intuitive user experience. Designed for the teams who close deals, Copper is helping people focus on what’s important: authentic relationships.","San Francisco, California, United States",2011,"Apps, CRM, Enterprise Software,,,",Copper offers customer relationship management solutions for companies that use Google applications.,"May 22, 2019",Series C,"$15,000,000","Google Ventures, Norwest Venture Partners,,,",$1M to $10M,—,"San Francisco Bay Area, West Coast,"
Grail,—,501-1000,"Grail develops a pan-cancer screening test designed to detect cancers at an early stage. Its pan-cancer screening test measures circulating nucleic acids in blood using high-intensity sequencing, population-scale clinical trials, enabling doctors to develop blood tests for early-stage cancer detection. The company was founded in 2016 by Alex Aravanis and Jeff Huber in Menlo Park, California.","Menlo Park, California, United States",2016,"Biotechnology, Health Care, Health Diagnostics,,",Grail develops a pan-cancer screening test designed to detect cancers at an early stage.,"May 6, 2020",Series D,"$390,000,000","ARCH Venture Partners, Google Ventures,,,",$100M to $500M,—,"San Francisco Bay Area, Silicon Valley,"
Aura,—,501-1000,"Aura is an information technology company dedicated to creating a safer internet for everyone. They are doing more online than ever but as our lives get more connected it's hard to know what’s safe. At Aura, they believe people should be able to live their digital lives with peace of mind. Their mission is to create a safer internet by making comprehensive digital security simple to understand and easy to use, so everyone can stay safe online.","Boston, Massachusetts, United States",2019,"Cyber Security, Information Technology,,",Aura is a unified digital threat protection platform that makes security simple for everyone.,"Oct 19, 2021",Series F,"$200,000,000","General Catalyst, Warburg Pincus,,,",—,—,"Greater Boston Area, East Coast,"
Butlr,—,11-50,"Butlr is an AIoT and real-time behavior analytics platform helping companies create a better workplace and optimize their operations. Butlr is a private-by-design people-sensing platform using body heat to detect occupancy, headcount, body posture, and activity, and generate accurate, real-time, and historical spatial insights. Butlr is a spin-off from the MIT Media Lab. The primary two use cases of Butlr sensors are the early diagnosis of elderly frailty and fall detection in the senior care industry and space management for commercial real estate. Butlr and its co-founders are recognized on Forbes 30 under 30 2022 List.","Burlingame, California, United States","Sep 10, 2019","Analytics, Artificial Intelligence,,,,,",Butlr is an AIoT and real-time behavior analytics platform helping companies create a better workplace and optimize their operations.,"Mar 22, 2023",Venture - Series Unknown,"$5,000,000","500 Global, Founder Collective,,,",$1M to $10M,Women Founded,"San Francisco Bay Area, West Coast,"
CIBC,—,10001+,"CIBC is a commercial banking firm that provides financial solutions for businesses. Their services include bank accounts, credit cards, mortgages, lending, investments, and insurance. Their protection service covers approved credit limits.","Toronto, Ontario, Canada",1867,"Banking, Credit Cards, Financial Services",CIBC is a financial service company that offers business solutions.,"Jun 8, 2022",Post-IPO Debt,"$800,000,000",—,$10B+,—,Great Lakes
